Grapheme	IPA
á	aː
aba	ɒ b ɒ
abajdoc	ɒ b ɒ j d o t͡s
abajgat	ɒ b ɒ j ɡ ɒ t
abál	ɒ b aː l
abcúg	ɒ b t͡s uː ɡ
ábdál	aː b d aː l
ábécé	aː b eː t͡s eː
abesszin	ɒ b ɛ sː i n
ablak	ɒ b l ɒ k
abora	ɒ b o r ɒ
abrak	ɒ b r ɒ k
abrakadabra	ɒ b r ɒ k ɒ d ɒ b r ɒ
ábrándozik	aː b r aː n d o z i k
ábráz	aː b r aː z
abriktol	ɒ b r i k t o l
abroncs	ɒ b r o n t͡ʃ
abrosz	ɒ b r o s
abszint	ɒ b s i n t
abszolút	ɒ b s o l uː t
abszolutizmus	ɒ b s o l u t i z m u ʃ
absztrakció	ɒ b s t r ɒ k t͡s i oː
absztrakt	ɒ b s t r ɒ k t
abszurd	ɒ b s u r d
acél	ɒ t͡s eː l
achát	ɒ h aː t
acintos	ɒ t͡s i n t o ʃ
ács	aː t͡ʃ
acsa	ɒ t͡ʃ ɒ
acsarkodik	ɒ t͡ʃ ɒ r k o d i k
ácsi	aː t͡ʃ i
ácsingózik	aː t͡ʃ i n ɡ oː z i k
ad	ɒ d
ádámcsutka	aː d aː m t͡ʃ u t k ɒ
ádámkosztüm	aː d aː m k o s t y m
ádázik	aː d aː z i k
adjunktus	ɒ d j u n k t u ʃ
adjusztál	ɒ d j u s t aː l
adjutáns	ɒ d j u t aː n ʃ
adminisztrátor	ɒ d m i n i s t r aː t o r
admirális	ɒ d m i r aː l i ʃ
adoma	ɒ d o m ɒ
adoptál	ɒ d o p t aː l
adresszíroz	ɒ d r ɛ sː iː r o z
adu	ɒ d u
advent	ɒ d v ɛ n t
affektál	ɒ fː ɛ k t aː l
affér	ɒ fː eː r
áfium	aː f i u m
áfonya	aː f o ɲ ɒ
afrik	ɒ f r i k
ág	aː ɡ
aga	ɒ ɡ ɒ
ágál	aː ɡ aː l
agancs	ɒ ɡ ɒ n t͡ʃ
agár	ɒ ɡ aː r
ágaskodik	aː ɡ ɒ ʃ k o d i k
ágbog	aː ɡ b o ɡ
ágenda	aː ɡ ɛ n d ɒ
ágens	aː ɡ ɛ n ʃ
agg	ɒ ɡː
aggastyán	ɒ ɡː ɒ ʃ c aː n
aggik	ɒ ɡː i k
agilis	ɒ ɡ i l i ʃ
agitál	ɒ ɡ i t aː l
agresszió	ɒ ɡ r ɛ sː i oː
agresszív	ɒ ɡ r ɛ sː iː v
ágrólszakadt	aː ɡ r oː l s ɒ k ɒ d t
agronómus	ɒ ɡ r o n oː m u ʃ
agy	ɒ ɟ
ágy	aː ɟ
agyabugyál	ɒ ɟ ɒ b u ɟ aː l
agyafúrt	ɒ ɟ ɒ f uː r t
agyag	ɒ ɟ ɒ ɡ
agyar	ɒ ɟ ɒ r
ágyék	aː ɟ eː k
ágynemű	aː ɟ n ɛ m yː
agyon	ɒ ɟ o n
ágyú	aː ɟ uː
áhít	aː h iː t
áj	aː j
ajak	ɒ j ɒ k
ajándék	ɒ j aː n d eː k
ajánl	ɒ j aː n l
ájer	aː j ɛ r
ajnároz	ɒ j n aː r o z
ájtatos	aː j t ɒ t o ʃ
ajtó	ɒ j t oː
ajtófél	ɒ j t oː f eː l
ájul	aː j u l
ajz	ɒ j z
akác	ɒ k aː t͡s
akadémia	ɒ k ɒ d eː m i ɒ
akar	ɒ k ɒ r
akár	ɒ k aː r
akaszt	ɒ k ɒ s t
akceptál	ɒ k t͡s ɛ p t aː l
akció	ɒ k t͡s i oː
akkord	ɒ kː o r d
akkumulál	ɒ kː u m u l aː l
akkumuláció	ɒ kː u m u l aː t͡s i oː
akkurátus	ɒ kː u r aː t u ʃ
akna	ɒ k n ɒ
akó	ɒ k oː
ákombákom	aː k o m b aː k o m
ákovita	aː k o v i t ɒ
akrobata	ɒ k r o b ɒ t ɒ
akt	ɒ k t
Akt	ɒ k t
akta	ɒ k t ɒ
aktivitás	ɒ k t i v i t aː ʃ
aktivizál	ɒ k t i v i z aː l
aktuális	ɒ k t u aː l i ʃ
aktus	ɒ k t u ʃ
akusztika	ɒ k u s t i k ɒ
akvarell	ɒ k v ɒ r ɛ lː
akvárium	ɒ k v aː r i u m
al	ɒ l
ál	aː l
alá	ɒ l aː
alabárd	ɒ l ɒ b aː r d
alabástrom	ɒ l ɒ b aː ʃ t r o m
alacsony	ɒ l ɒ t͡ʃ o ɲ
alafa	ɒ l ɒ f ɒ
alak	ɒ l ɒ k
alakor	ɒ l ɒ k o r
alamizsna	ɒ l ɒ m i ʒ n ɒ
alamuszi	ɒ l ɒ m u s i
alán	ɒ l aː n
alany	ɒ l ɒ ɲ
alap	ɒ l ɒ p
alarm	ɒ l ɒ r m
alarmíroz	ɒ l ɒ r m iː r o z
alászolgája	ɒ l aː s o l ɡ aː j ɒ
alattomban	ɒ l ɒ tː o m b ɒ n
alattság	ɒ l ɒ tː ʃ aː ɡ
alattvaló	ɒ l ɒ tː v ɒ l oː
alávaló	ɒ l aː v ɒ l oː
aláz	ɒ l aː z
albán	ɒ l b aː n
album	ɒ l b u m
álca	aː l t͡s ɒ
áld	aː l d
áldomás	aː l d o m aː ʃ
áldoz	aː l d o z
alél	ɒ l eː l
alfa	ɒ l f ɒ
alga	ɒ l ɡ ɒ
algebra	ɒ l ɡ ɛ b r ɒ
alibi	ɒ l i b i
alig	ɒ l i ɡ
alít	ɒ l iː t
alkat	ɒ l k ɒ t
alkohol	ɒ l k o h o l
alkonyodik	ɒ l k o ɲ o d i k
alkorán	ɒ l k o r aː n
alkot	ɒ l k o t
alkóv	ɒ l k oː v
alkörmös	ɒ l k ø r m ø ʃ
áll	aː lː
állag	aː lː ɒ ɡ
állam	aː lː ɒ m
állandó	aː lː ɒ n d oː
állapik	aː lː ɒ p i k
állapotos	aː lː ɒ p o t o ʃ
álláspont	aː lː aː ʃ p o n t
állat	aː lː ɒ t
allé	ɒ lː eː
alleluja	ɒ lː ɛ l u j ɒ
állítmány	aː lː iː t m aː ɲ
állítólag	aː lː iː t oː l ɒ ɡ
állkapca	aː lː k ɒ p t͡s ɒ
állkapocs	aː lː k ɒ p o t͡ʃ
állomás	aː lː o m aː ʃ
allűr	ɒ lː yː r
alma	ɒ l m ɒ
almanach	ɒ l m ɒ n ɒ h
almárium	ɒ l m aː r i u m
álmél	aː l m eː l
álnok	aː l n o k
aló	ɒ l oː
áloé	aː l o eː
alómars	ɒ l oː m ɒ r ʃ
álomszuszék	aː l o m s u s eː k
álorca	aː l o r t͡s ɒ
alpári	ɒ l p aː r i
alsó	ɒ l ʃ oː
alt	ɒ l t
által	aː l t ɒ l
általvető	aː l t ɒ l v ɛ t øː
alumínium	ɒ l u m iː n i u m
ám	aː m
amatőr	ɒ m ɒ t øː r
amazon	ɒ m ɒ z o n
ámbár	aː m b aː r
ambíció	ɒ m b iː t͡s i oː
ámbitus	aː m b i t u ʃ
ámbra	aː m b r ɒ
ambrózia	ɒ m b r oː z i ɒ
ámen	aː m ɛ n
ametiszt	ɒ m ɛ t i s t
amnesztia	ɒ m n ɛ s t i ɒ
ámokfutó	aː m o k f u t oː
ámpolna	aː m p o l n ɒ
ampulla	ɒ m p u lː ɒ
amputáció	ɒ m p u t aː t͡s i oː
ámul	aː m u l
amulett	ɒ m u l ɛ tː
analfabéta	ɒ n ɒ l f ɒ b eː t ɒ
ananász	ɒ n ɒ n aː s
anarchia	ɒ n ɒ r h i ɒ
andalodik	ɒ n d ɒ l o d i k
ándung	aː n d u n ɡ
anekdota	ɒ n ɛ k d o t ɒ
angária	ɒ n ɡ aː r i ɒ
angin	ɒ n ɡ i n
anglikán	ɒ n ɡ l i k aː n
anglus	ɒ n ɡ l u ʃ
angolna	ɒ n ɡ o l n ɒ
ángy	aː n ɟ
angyal	ɒ n ɟ ɒ l
angyalbőr	ɒ n ɟ ɒ l b øː r
angyélika	ɒ n ɟ eː l i k ɒ
ánizs	aː n i ʒ
ankét	ɒ n k eː t
anorák	ɒ n o r aː k
ánslóg	aː n ʃ l oː ɡ
antal	ɒ n t ɒ l
antenna	ɒ n t ɛ nː ɒ
antik	ɒ n t i k
antikvárius	ɒ n t i k v aː r i u ʃ
antilop	ɒ n t i l o p
antipátia	ɒ n t i p aː t i ɒ
anya	ɒ ɲ ɒ
anyag	ɒ ɲ ɒ ɡ
anyakönyv	ɒ ɲ ɒ k ø ɲ v
anyanyelv	ɒ ɲ ɒ ɲ ɛ l v
anyarozs	ɒ ɲ ɒ r o ʒ
anyaszentegyház	ɒ ɲ ɒ s ɛ n t ɛ ɟ h aː z
annyi	ɒ ɲː i
anyós	ɒ ɲ oː ʃ
apa	ɒ p ɒ
apáca	ɒ p aː t͡s ɒ
apacs	ɒ p ɒ t͡ʃ
apad	ɒ p ɒ d
apaszt	ɒ p ɒ s t
apanázs	ɒ p ɒ n aː ʒ
apát	ɒ p aː t
apellál	ɒ p ɛ lː aː l
áperte	aː p ɛ r t ɛ
apetitus	ɒ p ɛ t i t u ʃ
ápol	aː p o l
áporodik	aː p o r o d i k
após	ɒ p oː ʃ
apostol	ɒ p o ʃ t o l
apparátus	ɒ pː ɒ r aː t u ʃ
aprehendál	ɒ p r ɛ h ɛ n d aː l
április	aː p r i l i ʃ
aprócseprő	ɒ p r oː t͡ʃ ɛ p r øː
apród	ɒ p r oː d
apropó	ɒ p r o p oː
ár	aː r
ara	ɒ r ɒ
arab	ɒ r ɒ b
aranka	ɒ r ɒ n k ɒ
arany	ɒ r ɒ ɲ
aranyér	ɒ r ɒ ɲ eː r
arasz	ɒ r ɒ s
arat	ɒ r ɒ t
árbóc	aː r b oː t͡s
archaizmus	ɒ r h ɒ i z m u ʃ
archívum	ɒ r h iː v u m
ardó	ɒ r d oː
aréna	ɒ r eː n ɒ
árendál	aː r ɛ n d aː l
árestál	aː r ɛ ʃ t aː l
árfolyam	aː r f o j ɒ m
argó	ɒ r ɡ oː
argumentum	ɒ r ɡ u m ɛ n t u m
árgusszem	aː r ɡ u sː ɛ m
árguvál	aː r ɡ u v aː l
árgyélus	aː r ɟ eː l u ʃ
ária	aː r i ɒ
arisztokrácia	ɒ r i s t o k r aː t͡s i ɒ
árja	aː r j ɒ
árkád	aː r k aː d
arkangyal	ɒ r k ɒ n ɟ ɒ l
árkány	aː r k aː ɲ
árkus	aː r k u ʃ
armada	ɒ r m ɒ d ɒ
ármális	aː r m aː l i ʃ
ármányos	aː r m aː ɲ o ʃ
ármány	aː r m aː ɲ
ármás	aː r m aː ʃ
arnót	ɒ r n oː t
árnyék	aː r ɲ eː k
árnyékszék	aː r ɲ eː k s eː k
aroma	ɒ r o m ɒ
árpa	aː r p ɒ
árt	aː r t
ártány	aː r t aː ɲ
artézikút	ɒ r t eː z i k uː t
articsóka	ɒ r t i t͡ʃ oː k ɒ
artikulál	ɒ r t i k u l aː l
artista	ɒ r t i ʃ t ɒ
áru	aː r u
árva	aː r v ɒ
árvácska	aː r v aː t͡ʃ k ɒ
árvalányhaj	aː r v ɒ l aː ɲ h ɒ j
árverés	aː r v ɛ r eː ʃ
árvíz	aː r v iː z
arzenál	ɒ r z ɛ n aː l
ás	aː ʃ
ásít	aː ʃ iː t
áskál	aː ʃ k aː l
áspa	aː ʃ p ɒ
aspirál	ɒ ʃ p i r aː l
aspiráció	ɒ ʃ p i r aː t͡s i oː
aspiráns	ɒ ʃ p i r aː n ʃ
áspis	aː ʃ p i ʃ
ásvány	aː ʃ v aː ɲ
ász	aː s
aszat	ɒ s ɒ t
aszfalt	ɒ s f ɒ l t
aszik	ɒ s i k
aszkézis	ɒ s k eː z i ʃ
aszpik	ɒ s p i k
aszpirin	ɒ s p i r i n
asszír	ɒ sː iː r
asszisztál	ɒ sː i s t aː l
asszó	ɒ sː oː
asszony	ɒ sː o ɲ
asztag	ɒ s t ɒ ɡ
asztal	ɒ s t ɒ l
asztalnok	ɒ s t ɒ l n o k
asztma	ɒ s t m ɒ
asztrakán	ɒ s t r ɒ k aː n
aszú	ɒ s uː
átabotás	aː t ɒ b o t aː ʃ
átalag	aː t ɒ l ɒ ɡ
átall	aː t ɒ lː
ateizmus	ɒ t ɛ i z m u ʃ
atilla	ɒ t i lː ɒ
atka	ɒ t k ɒ
átkoz	aː t k o z
átlag	aː t l ɒ ɡ
atlasz	ɒ t l ɒ s
atléta	ɒ t l eː t ɒ
átló	aː t l oː
atmoszféra	ɒ t m o s f eː r ɒ
atom	ɒ t o m
atracél	ɒ t r ɒ t͡s eː l
attakíroz	ɒ tː ɒ k iː r o z
attrakció	ɒ tː r ɒ k t͡s i oː
atval	ɒ t v ɒ l
atya	ɒ c ɒ
atyafi	ɒ c ɒ f i
augusztus	ɒ u ɡ u s t u ʃ
aula	ɒ u l ɒ
autó	ɒ u t oː
autóbusz	ɒ u t oː b u s
autogram	ɒ u t o ɡ r ɒ m
automata	ɒ u t o m ɒ t ɒ
automatizál	ɒ u t o m ɒ t i z aː l
automobil	ɒ u t o m o b i l
autonómia	ɒ u t o n oː m i ɒ
avagy	ɒ v ɒ ɟ
avar	ɒ v ɒ r
avas	ɒ v ɒ ʃ
avat	ɒ v ɒ t
avik	ɒ v i k
avul	ɒ v u l
avít	ɒ v iː t
az	ɒ z
azaz	ɒ z ɒ z
azbeszt	ɒ z b ɛ s t
ázik	aː z i k
azonban	ɒ z o n b ɒ n
azonnal	ɒ z o nː ɒ l
azonos	ɒ z o n o ʃ
azúr	ɒ z uː r
azután	ɒ z u t aː n
azsag	ɒ ʒ ɒ ɡ
ázsió	aː ʒ i oː
azsúr	ɒ ʒ uː r
bab	b ɒ b
báb	b aː b
baba	b ɒ b ɒ
bába	b aː b ɒ
babér	b ɒ b eː r
babirkál	b ɒ b i r k aː l
bábó	b aː b oː
babona	b ɒ b o n ɒ
bábu	b aː b u
babug	b ɒ b u ɡ
babuk	b ɒ b u k
babusgat	b ɒ b u ʃ ɡ ɒ t
bacilus	b ɒ t͡s i l u ʃ
bács	b aː t͡ʃ
bácsi	b aː t͡ʃ i
badar	b ɒ d ɒ r
bádog	b aː d o ɡ
bagaria	b ɒ ɡ ɒ r i ɒ
bagatell	b ɒ ɡ ɒ t ɛ lː
bagazia	b ɒ ɡ ɒ z i ɒ
bagázsia	b ɒ ɡ aː ʒ i ɒ
bagó	b ɒ ɡ oː
bagócs	b ɒ ɡ oː t͡ʃ
bagóhit	b ɒ ɡ oː h i t
bagoly	b ɒ ɡ o j
bagzik	b ɒ ɡ z i k
bágyad	b aː ɟ ɒ d
bágyaszt	b aː ɟ ɒ s t
baj	b ɒ j
bajnok	b ɒ j n o k
bajonett	b ɒ j o n ɛ tː
bajor	b ɒ j o r
bájos	b aː j o ʃ
bajtárs	b ɒ j t aː r ʃ
bajusz	b ɒ j u s
bajvívás	b ɒ j v iː v aː ʃ
bak	b ɒ k
baka	b ɒ k ɒ
bakacsin	b ɒ k ɒ t͡ʃ i n
bakafántos	b ɒ k ɒ f aː n t o ʃ
bakancs	b ɒ k ɒ n t͡ʃ
bakator	b ɒ k ɒ t o r
bakcsó	b ɒ k t͡ʃ oː
bakelit	b ɒ k ɛ l i t
bakfis	b ɒ k f i ʃ
bakló	b ɒ k l oː
bakó	b ɒ k oː
bakol	b ɒ k o l
baksis	b ɒ k ʃ i ʃ
baktat	b ɒ k t ɒ t
bakter	b ɒ k t ɛ r
baktérium	b ɒ k t eː r i u m
bal	b ɒ l
bál	b aː l
bála	b aː l ɒ
balalajka	b ɒ l ɒ l ɒ j k ɒ
balaska	b ɒ l ɒ ʃ k ɒ
baldachin	b ɒ l d ɒ h i n
balek	b ɒ l ɛ k
balerina	b ɒ l ɛ r i n ɒ
balett	b ɒ l ɛ tː
balgatag	b ɒ l ɡ ɒ t ɒ ɡ
balhé	b ɒ l h eː
balin	b ɒ l i n
bális	b aː l i ʃ
balkány	b ɒ l k aː ɲ
balkon	b ɒ l k o n
ballada	b ɒ lː ɒ d ɒ
ballag	b ɒ lː ɒ ɡ
ballaszt	b ɒ lː ɒ s t
ballon	b ɒ lː o n
bálmos	b aː l m o ʃ
bálna	b aː l n ɒ
balta	b ɒ l t ɒ
baltacim	b ɒ l t ɒ t͡s i m
bálvány	b aː l v aː ɲ
balzsam	b ɒ l ʒ ɒ m
bamba	b ɒ m b ɒ
bambusz	b ɒ m b u s
bán	b aː n
banán	b ɒ n aː n
banda	b ɒ n d ɒ
bandérium	b ɒ n d eː r i u m
bandita	b ɒ n d i t ɒ
bandukol	b ɒ n d u k o l
bandzsal	b ɒ n d͡ʒ ɒ l
bánik	b aː n i k
bank	b ɒ n k
banka	b ɒ n k ɒ
bankett	b ɒ n k ɛ tː
bankír	b ɒ n k iː r
bankó	b ɒ n k oː
bánt	b aː n t
banya	b ɒ ɲ ɒ
bánya	b aː ɲ ɒ
baptista	b ɒ p t i ʃ t ɒ
bár	b aː r
baráber	b ɒ r aː b ɛ r
baraboly	b ɒ r ɒ b o j
barack	b ɒ r ɒ t͡s k
barakk	b ɒ r ɒ kː
barangol	b ɒ r ɒ n ɡ o l
bárány	b aː r aː ɲ
bárányhimlő	b aː r aː ɲ h i m l øː
barát	b ɒ r aː t
barátfüle	b ɒ r aː t f y l ɛ
baratina	b ɒ r ɒ t i n ɒ
barátkeselyű	b ɒ r aː t k ɛ ʃ ɛ j yː
barázda	b ɒ r aː z d ɒ
barázdabillegető	b ɒ r aː z d ɒ b i lː ɛ ɡ ɛ t øː
barbár	b ɒ r b aː r
bárca	b aː r t͡s ɒ
bárcs	b aː r t͡ʃ
bárd	b aː r d
bárgyú	b aː r ɟ uː
barhent	b ɒ r h ɛ n t
barikád	b ɒ r i k aː d
bariton	b ɒ r i t o n
barka	b ɒ r k ɒ
bárka	b aː r k ɒ
barkács	b ɒ r k aː t͡ʃ
barkó	b ɒ r k oː
barkóca	b ɒ r k oː t͡s ɒ
barkochba	b ɒ r k o h b ɒ
barlang	b ɒ r l ɒ n ɡ
barna	b ɒ r n ɒ
báró	b aː r oː
barokk	b ɒ r o kː
barom	b ɒ r o m
barométer	b ɒ r o m eː t ɛ r
baromfi	b ɒ r o m f i
bársony	b aː r ʃ o ɲ
bárzsing	b aː r ʒ i n ɡ
basa	b ɒ ʃ ɒ
baskír	b ɒ ʃ k iː r
bástya	b aː ʃ c ɒ
baszik	b ɒ s i k
baszk	b ɒ s k
basszus	b ɒ sː u ʃ
batár	b ɒ t aː r
batik	b ɒ t i k
batiszt	b ɒ t i s t
batka	b ɒ t k ɒ
bátor	b aː t o r
battéria	b ɒ tː eː r i ɒ
batul	b ɒ t u l
bátya	b aː c ɒ
batykó	b ɒ c k oː
batyu	b ɒ c u
bauxit	b ɒ u k s i t
bávad	b aː v ɒ d
bazalt	b ɒ z ɒ l t
bazár	b ɒ z aː r
bazilika	b ɒ z i l i k ɒ
baziliszkusz	b ɒ z i l i s k u s
bázis	b aː z i ʃ
bazsalikom	b ɒ ʒ ɒ l i k o m
bazsalyog	b ɒ ʒ ɒ j o ɡ
bazsarózsa	b ɒ ʒ ɒ r oː ʒ ɒ
be	b ɛ
bébi	b eː b i
bece	b ɛ t͡s ɛ
becő	b ɛ t͡s øː
becs	b ɛ t͡ʃ
becsmérel	b ɛ t͡ʃ m eː r ɛ l
bécs	b eː t͡ʃ
becsiccsent	b ɛ t͡ʃ i t͡ʃː ɛ n t
beduin	b ɛ d u i n
befolyás	b ɛ f o j aː ʃ
befőtt	b ɛ f øː tː
bég	b eː ɡ
beglerbég	b ɛ ɡ l ɛ r b eː ɡ
begy	b ɛ ɟ
behemót	b ɛ h ɛ m oː t
bejgli	b ɛ j ɡ l i
béka	b eː k ɒ
béke	b eː k ɛ
bekecs	b ɛ k ɛ t͡ʃ
béklyó	b eː k j oː
bekrepál	b ɛ k r ɛ p aː l
bél	b eː l
bele	b ɛ l ɛ
belég	b ɛ l eː ɡ
beleget	b ɛ l ɛ ɡ ɛ t
belénd	b ɛ l eː n d
beléndes	b ɛ l eː n d ɛ ʃ
béles	b eː l ɛ ʃ
bélés	b eː l eː ʃ
belga	b ɛ l ɡ ɒ
abbeli	ɒ bː ɛ l i
belice	b ɛ l i t͡s ɛ
bélpoklos	b eː l p o k l o ʃ
belső	b ɛ l ʃ øː
belül	b ɛ l y l
bélyeg	b eː j ɛ ɡ
béna	b eː n ɒ
bencés	b ɛ n t͡s eː ʃ
bendő	b ɛ n d øː
benne	b ɛ nː ɛ
benneteket	b ɛ nː ɛ t ɛ k ɛ t
bennünket	b ɛ nː y n k ɛ t
bennfentes	b ɛ nː f ɛ n t ɛ ʃ
benzin	b ɛ n z i n
bér	b eː r
berbécs	b ɛ r b eː t͡ʃ
berbence	b ɛ r b ɛ n t͡s ɛ
berber	b ɛ r b ɛ r
berbitél	b ɛ r b i t eː l
bérc	b eː r t͡s
berce	b ɛ r t͡s ɛ
berdó	b ɛ r d oː
berek	b ɛ r ɛ k
beretra	b ɛ r ɛ t r ɒ
bergám	b ɛ r ɡ aː m
berhe	b ɛ r h ɛ
berill	b ɛ r i lː
berke	b ɛ r k ɛ
berkenye	b ɛ r k ɛ ɲ ɛ
bérmál	b eː r m aː l
berreg	b ɛ rː ɛ ɡ
bervéng	b ɛ r v eː n ɡ
berzenkedik	b ɛ r z ɛ n k ɛ d i k
bese	b ɛ ʃ ɛ
besenyő	b ɛ ʃ ɛ ɲ øː
beslia	b ɛ ʃ l i ɒ
beste	b ɛ ʃ t ɛ
bestia	b ɛ ʃ t i ɒ
bestiális	b ɛ ʃ t i aː l i ʃ
beszéd	b ɛ s eː d
beszély	b ɛ s eː j
beszerika	b ɛ s ɛ r i k ɒ
beteg	b ɛ t ɛ ɡ
betlehem	b ɛ t l ɛ h ɛ m
beton	b ɛ t o n
betű	b ɛ t yː
betyár	b ɛ c aː r
bezzeg	b ɛ zː ɛ ɡ
biankó	b i ɒ n k oː
bibasz	b i b ɒ s
bibe	b i b ɛ
bíbelődik	b iː b ɛ l øː d i k
biber	b i b ɛ r
bibi	b i b i
bíbic	b iː b i t͡s
bibircs	b i b i r t͡ʃ
biblia	b i b l i ɒ
bibliotéka	b i b l i o t eː k ɒ
bíbor	b iː b o r
biccent	b i t͡sː ɛ n t
bicikli	b i t͡s i k l i
bicsak	b i t͡ʃ ɒ k
bicsaklik	b i t͡ʃ ɒ k l i k
bicska	b i t͡ʃ k ɒ
bifláz	b i f l aː z
bifsztek	b i f s t ɛ k
bigámia	b i ɡ aː m i ɒ
b	b
bigott	b i ɡ o tː
biggyeszt	b i ɟː ɛ s t
bigyeg	b i ɟ ɛ ɡ
bigyó	b i ɟ oː
bika	b i k ɒ
bikavér	b i k ɒ v eː r
bikfic	b i k f i t͡s
bikini	b i k i n i
biléta	b i l eː t ɒ
bili	b i l i
biliárd	b i l i aː r d
bilincs	b i l i n t͡ʃ
billeg	b i lː ɛ ɡ
billen	b i lː ɛ n
billikom	b i lː i k o m
billió	b i lː i oː
bimbam	b i m b ɒ m
bimbó	b i m b oː
bincsók	b i n t͡ʃ oː k
biológia	b i o l oː ɡ i ɒ
bír	b iː r
birizgál	b i r i z ɡ aː l
birka	b i r k ɒ
birkodik	b i r k o d i k
bíró	b iː r oː
bírság	b iː r ʃ aː ɡ
bisztró	b i s t r oː
bitang	b i t ɒ n ɡ
bitó	b i t oː
bitol	b i t o l
bitumen	b i t u m ɛ n
bivaly	b i v ɒ j
bizarr	b i z ɒ rː
bizgat	b i z ɡ ɒ t
bízik	b iː z i k
bizmut	b i z m u t
bizony	b i z o ɲ
bizton	b i z t o n
biztos	b i z t o ʃ
bízvást	b iː z v aː ʃ t
bizserél	b i ʒ ɛ r eː l
bizsu	b i ʒ u
blamíroz	b l ɒ m iː r o z
blanketta	b l ɒ n k ɛ tː ɒ
blatt	b l ɒ tː
blazírt	b l ɒ z iː r t
bliccel	b l i t͡sː ɛ l
bliktri	b l i k t r i
blokád	b l o k aː d
blokk	b l o kː
blöff	b l ø fː
blúz	b l uː z
boa	b o ɒ
bóbiskol	b oː b i ʃ k o l
bóbita	b oː b i t ɒ
bócér	b oː t͡s eː r
boci	b o t͡s i
bocs	b o t͡ʃ
bocsánat	b o t͡ʃ aː n ɒ t
bocsár	b o t͡ʃ aː r
bocsát	b o t͡ʃ aː t
bocska	b o t͡ʃ k ɒ
bocskor	b o t͡ʃ k o r
bóda	b oː d ɒ
bódé	b oː d eː
bodega	b o d ɛ ɡ ɒ
bódít	b oː d iː t
bodnár	b o d n aː r
bodobács	b o d o b aː t͡ʃ
bodócs	b o d oː t͡ʃ
bodor	b o d o r
bódorog	b oː d o r o ɡ
bodza	b o d͡z ɒ
bodzfa	b o d͡z f ɒ
bog	b o ɡ
bogáncs	b o ɡ aː n t͡ʃ
bogár	b o ɡ aː r
boglár	b o ɡ l aː r
boglya	b o ɡ j ɒ
isbognár	i ʃ b o ɡ n aː r
bogrács	b o ɡ r aː t͡ʃ
bogyó	b o ɟ oː
bohém	b o h eː m
bohó	b o h oː
bója	b oː j ɒ
bojár	b o j aː r
bojkott	b o j k o tː
bojnyik	b o j ɲ i k
bojt	b o j t
bojtár	b o j t aː r
bojtorján	b o j t o r j aː n
bojtorkodik	b o j t o r k o d i k
boka	b o k ɒ
bokály	b o k aː j
bóklál	b oː k l aː l
bókol	b oː k o l
bokolyó	b o k o j oː
bókony	b oː k o ɲ
bokor	b o k o r
bokorugró	b o k o r u ɡ r oː
bokréta	b o k r eː t ɒ
boksa	b o k ʃ ɒ
boksz	b o k s
boldog	b o l d o ɡ
bólé	b oː l eː
boleró	b o l ɛ r oː
bolgár	b o l ɡ aː r
bolha	b o l h ɒ
bólogat	b oː l o ɡ ɒ t
bolond	b o l o n d
bolonyik	b o l o ɲ i k
bolsevik	b o l ʃ ɛ v i k
bolt	b o l t
boly	b o j
bolyh	b o j h
bolyong	b o j o n ɡ
bomba	b o m b ɒ
bombarda	b o m b ɒ r d ɒ
bombardon	b o m b ɒ r d o n
bombaszt	b o m b ɒ s t
bon	b o n
bonbon	b o n b o n
bonc	b o n t͡s
boncol	b o n t͡s o l
boncsok	b o n t͡ʃ o k
bong	b o n ɡ
bongor	b o n ɡ o r
bont	b o n t
bonta	b o n t ɒ
bonviván	b o n v i v aː n
bonyolít	b o ɲ o l iː t
bor	b o r
bór	b oː r
bóra	b oː r ɒ
bórax	b oː r ɒ k s
borbély	b o r b eː j
borbolya	b o r b o j ɒ
borda	b o r d ɒ
bordély	b o r d eː j
bordó	b o r d oː
borissza	b o r i sː ɒ
borít	b o r iː t
borul	b o r u l
borjú	b o r j uː
bornírt	b o r n iː r t
boróka	b o r oː k ɒ
borona	b o r o n ɒ
borosta	b o r o ʃ t ɒ
borostyán	b o r o ʃ c aː n
boroszlán	b o r o s l aː n
borotva	b o r o t v ɒ
borovicska	b o r o v i t͡ʃ k ɒ
borravaló	b o rː ɒ v ɒ l oː
bors	b o r ʃ
borsó	b o r ʃ oː
borsóka	b o r ʃ oː k ɒ
borz	b o r z
borzad	b o r z ɒ d
borzalom	b o r z ɒ l o m
bosnyák	b o ʃ ɲ aː k
boszorkány	b o s o r k aː ɲ
bosszant	b o sː ɒ n t
bosszú	b o sː uː
bosztán	b o s t aː n
bot	b o t
botanikus	b o t ɒ n i k u ʃ
botfülű	b o t f y l yː
botlik	b o t l i k
botor	b o t o r
botos	b o t o ʃ
botránkozik	b o t r aː n k o z i k
botrány	b o t r aː ɲ
bóvli	b oː v l i
boza	b o z ɒ
bozontos	b o z o n t o ʃ
bozót	b o z oː t
bő	b øː
bödön	b ø d ø n
böfög	b ø f ø ɡ
bőg	b øː ɡ
bögöly	b ø ɡ ø j
bögre	b ø ɡ r ɛ
bögyörő	b ø ɟ ø r øː
böjt	b ø j t
bök	b ø k
bőkezű	b øː k ɛ z yː
bökken	b ø kː ɛ n
bölcs	b ø l t͡ʃ
bölcső	b ø l t͡ʃ øː
bölény	b ø l eː ɲ
böllér	b ø lː eː r
bölömbika	b ø l ø m b i k ɒ
bömböl	b ø m b ø l
böngészik	b ø n ɡ eː s i k
bőr	b øː r
börberi	b ø r b ɛ r i
bőregér	b øː r ɛ ɡ eː r
bőrönd	b øː r ø n d
börtő	b ø r t øː
börtön	b ø r t ø n
börze	b ø r z ɛ
börzsöny	b ø r ʒ ø ɲ
bőszít	b øː s iː t
böszörmény	b ø s ø r m eː ɲ
brácsa	b r aː t͡ʃ ɒ
bráha	b r aː h ɒ
brancs	b r ɒ n t͡ʃ
bravó	b r ɒ v oː
brávó	b r aː v oː
bravúr	b r ɒ v uː r
brekeg	b r ɛ k ɛ ɡ
bricsesz	b r i t͡ʃ ɛ s
bricska	b r i t͡ʃ k ɒ
bridzs	b r i d͡ʒ
brigád	b r i ɡ aː d
brigadéros	b r i ɡ ɒ d eː r o ʃ
briganti	b r i ɡ ɒ n t i
brikett	b r i k ɛ tː
briliáns	b r i l i aː n ʃ
brillíroz	b r i lː iː r o z
brindza	b r i n d͡z ɒ
bringa	b r i n ɡ ɒ
briós	b r i oː ʃ
brit	b r i t
brokatell	b r o k ɒ t ɛ lː
bróm	b r oː m
bronz	b r o n z
bross	b r o ʃː
brosúra	b r o ʃ uː r ɒ
brr	b rː
brúgó	b r uː ɡ oː
brummog	b r u mː o ɡ
brutális	b r u t aː l i ʃ
bruttó	b r u tː oː
bú	b uː
búb	b uː b
buba	b u b ɒ
bubi	b u b i
bubolyicska	b u b o j i t͡ʃ k ɒ
buborék	b u b o r eː k
buci	b u t͡s i
buckó	b u t͡s k oː
búcsú	b uː t͡ʃ uː
buda	b u d ɒ
isbufa	i ʃ b u f ɒ
bufán	b u f aː n
búg	b uː ɡ
buga	b u ɡ ɒ
buger	b u ɡ ɛ r
bugris	b u ɡ r i ʃ
bugyborék	b u ɟ b o r eː k
bugyelláris	b u ɟ ɛ lː aː r i ʃ
bugylibicska	b u ɟ l i b i t͡ʃ k ɒ
bugyog	b u ɟ o ɡ
bugyolál	b u ɟ o l aː l
bugyor	b u ɟ o r
buja	b u j ɒ
bújik	b uː j i k
bujt	b u j t
bukéta	b u k eː t ɒ
bukfenc	b u k f ɛ n t͡s
bukik	b u k i k
buksi	b u k ʃ i
buksza	b u k s ɒ
bukszus	b u k s u ʃ
bukta	b u k t ɒ
bulándra	b u l aː n d r ɒ
buldog	b u l d o ɡ
buli	b u l i
bulla	b u lː ɒ
bulvár	b u l v aː r
bulya	b u j ɒ
bumeráng	b u m ɛ r aː n ɡ
bumfordi	b u m f o r d i
bumli	b u m l i
bunda	b u n d ɒ
bunker	b u n k ɛ r
bunkó	b u n k oː
bunyevác	b u ɲ ɛ v aː t͡s
bunyó	b u ɲ oː
búr	b uː r
burdó	b u r d oː
burgonya	b u r ɡ o ɲ ɒ
burgundi	b u r ɡ u n d i
burján	b u r j aː n
burját	b u r j aː t
burkus	b u r k u ʃ
burleszk	b u r l ɛ s k
burnót	b u r n oː t
burnusz	b u r n u s
burok	b u r o k
burzsoá	b u r ʒ o aː
busa	b u ʃ ɒ
busás	b u ʃ aː ʃ
busz	b u s
búsz	b uː s
buszma	b u s m ɒ
buszujog	b u s u j o ɡ
buta	b u t ɒ
butélia	b u t eː l i ɒ
butik	b u t i k
bútor	b uː t o r
butykó	b u c k oː
butykos	b u c k o ʃ
búvár	b uː v aː r
búza	b uː z ɒ
búzavirág	b uː z ɒ v i r aː ɡ
buzér	b u z eː r
buzeráns	b u z ɛ r aː n ʃ
buzog	b u z o ɡ
buzogány	b u z o ɡ aː ɲ
bű	b yː
bűbáj	b yː b aː j
büdös	b y d ø ʃ
büdöske	b y d ø ʃ k ɛ
büdzsé	b y d͡ʒ eː
büfé	b y f eː
bükk	b y kː
bükköny	b y kː ø ɲ
bűn	b yː n
bűnbak	b yː n b ɒ k
bürokrata	b y r o k r ɒ t ɒ
bürök	b y r ø k
bürü	b y r y
büszke	b y s k ɛ
bütü	b y t y
bütyök	b y c ø k
bűvész	b yː v eː s
bűvös	b yː v ø ʃ
bűz	b yː z
csiga	t͡ʃ i ɡ ɒ
cafat	t͡s ɒ f ɒ t
cafatos	t͡s ɒ f ɒ t o ʃ
cafka	t͡s ɒ f k ɒ
cáfol	t͡s aː f o l
cafra	t͡s ɒ f r ɒ
cafrang	t͡s ɒ f r ɒ n ɡ
cajg	t͡s ɒ j ɡ
cakni	t͡s ɒ k n i
cakó	t͡s ɒ k oː
cakompakk	t͡s ɒ k o m p ɒ kː
cammog	t͡s ɒ mː o ɡ
canga	t͡s ɒ n ɡ ɒ
cankó	t͡s ɒ n k oː
cankózik	t͡s ɒ n k oː z i k
cáp	t͡s aː p
capa	t͡s ɒ p ɒ
cápa	t͡s aː p ɒ
capistráng	t͡s ɒ p i ʃ t r aː n ɡ
cappolódik	t͡s ɒ pː o l oː d i k
cár	t͡s aː r
cavira	t͡s ɒ v i r ɒ
cech	t͡s ɛ h
cécó	t͡s eː t͡s oː
céda	t͡s eː d ɒ
cédrus	t͡s eː d r u ʃ
cédula	t͡s eː d u l ɒ
cefet	t͡s ɛ f ɛ t
cefre	t͡s ɛ f r ɛ
cég	t͡s eː ɡ
cégér	t͡s eː ɡ eː r
céh	t͡s eː h
cejte	t͡s ɛ j t ɛ
cékál	t͡s eː k aː l
cékláz	t͡s eː k l aː z
cika	t͡s i k ɒ
cekker	t͡s ɛ kː ɛ r
cékla	t͡s eː k l ɒ
cél	t͡s eː l
celebrál	t͡s ɛ l ɛ b r aː l
celecula	t͡s ɛ l ɛ t͡s u l ɒ
cella	t͡s ɛ lː ɒ
cellulóz	t͡s ɛ lː u l oː z
celofán	t͡s ɛ l o f aː n
cemende	t͡s ɛ m ɛ n d ɛ
cement	t͡s ɛ m ɛ n t
cementíroz	t͡s ɛ m ɛ n t iː r o z
cendely	t͡s ɛ n d ɛ j
cenk	t͡s ɛ n k
centi	t͡s ɛ n t i
centrális	t͡s ɛ n t r aː l i ʃ
centrifuga	t͡s ɛ n t r i f u ɡ ɒ
centrifugális	t͡s ɛ n t r i f u ɡ aː l i ʃ
centrum	t͡s ɛ n t r u m
cenzúra	t͡s ɛ n z uː r ɒ
ceremónia	t͡s ɛ r ɛ m oː n i ɒ
cerkó	t͡s ɛ r k oː
cerkófmajom	t͡s ɛ r k oː f m ɒ j o m
cérna	t͡s eː r n ɒ
ceruza	t͡s ɛ r u z ɒ
cet	t͡s ɛ t
cetli	t͡s ɛ t l i
cézár	t͡s eː z aː r
cián	t͡s i aː n
cibak	t͡s i b ɒ k
cibál	t͡s i b aː l
cibere	t͡s i b ɛ r ɛ
cibetmacska	t͡s i b ɛ t m ɒ t͡ʃ k ɒ
cibóka	t͡s i b oː k ɒ
cic	t͡s i t͡s
cica	t͡s i t͡s ɒ
cicerél	t͡s i t͡s ɛ r eː l
cici	t͡s i t͡s i
cickány	t͡s i t͡s k aː ɲ
cicomáz	t͡s i t͡s o m aː z
cidri	t͡s i d r i
cidrizik	t͡s i d r i z i k
cifra	t͡s i f r ɒ
cigája	t͡s i ɡ aː j ɒ
cigány	t͡s i ɡ aː ɲ
cigaretta	t͡s i ɡ ɒ r ɛ tː ɒ
cre	t͡s r ɛ
cigle	t͡s i ɡ l ɛ
ciha	t͡s i h ɒ
ciher	t͡s i h ɛ r
cihog	t͡s i h o ɡ
cihődik	t͡s i h øː d i k
cihelődik	t͡s i h ɛ l øː d i k
cikcakk	t͡s i k t͡s ɒ kː
cikény	t͡s i k eː ɲ
ciki	t͡s i k i
cikkely	t͡s i kː ɛ j
ciklámen	t͡s i k l aː m ɛ n
ciklon	t͡s i k l o n
ciklus	t͡s i k l u ʃ
cikória	t͡s i k oː r i ɒ
cikornya	t͡s i k o r ɲ ɒ
cilinder	t͡s i l i n d ɛ r
cím	t͡s iː m
cimbalom	t͡s i m b ɒ l o m
cimbora	t͡s i m b o r ɒ
címer	t͡s iː m ɛ r
cimpa	t͡s i m p ɒ
cin	t͡s i n
cinadof	t͡s i n ɒ d o f
cinadónia	t͡s i n ɒ d oː n i ɒ
cincál	t͡s i n t͡s aː l
cincár	t͡s i n t͡s aː r
cincér	t͡s i n t͡s eː r
cincog	t͡s i n t͡s o ɡ
cineg	t͡s i n ɛ ɡ
cinege	t͡s i n ɛ ɡ ɛ
cingár	t͡s i n ɡ aː r
cinikus	t͡s i n i k u ʃ
cink	t͡s i n k
cinke	t͡s i n k ɛ
cinkos	t͡s i n k o ʃ
cinóber	t͡s i n oː b ɛ r
cintányér	t͡s i n t aː ɲ eː r
cinterem	t͡s i n t ɛ r ɛ m
cipekedik	t͡s i p ɛ k ɛ d i k
cipellős	t͡s i p ɛ lː øː ʃ
cipó	t͡s i p oː
cipő	t͡s i p øː
ciprus	t͡s i p r u ʃ
cipszer	t͡s i p s ɛ r
cipzár	t͡s i p z aː r
ciráda	t͡s i r aː d ɒ
cirbolya	t͡s i r b o j ɒ
cirfandli	t͡s i r f ɒ n d l i
ciripel	t͡s i r i p ɛ l
cirka	t͡s i r k ɒ
cirkál	t͡s i r k aː l
cirkalom	t͡s i r k ɒ l o m
cirkulál	t͡s i r k u l aː l
cirkusz	t͡s i r k u s
cirmol	t͡s i r m o l
cirok	t͡s i r o k
cirókál	t͡s i r oː k aː l
ciszterci	t͡s i s t ɛ r t͡s i
ciszterna	t͡s i s t ɛ r n ɒ
citadella	t͡s i t ɒ d ɛ lː ɒ
citál	t͡s i t aː l
citera	t͡s i t ɛ r ɒ
citrom	t͡s i t r o m
citvar	t͡s i t v ɒ r
civakodik	t͡s i v ɒ k o d i k
civil	t͡s i v i l
civilizál	t͡s i v i l i z aː l
cívis	t͡s iː v i ʃ
cizellíroz	t͡s i z ɛ lː iː r o z
co	t͡s o
coboly	t͡s o b o j
cókmók	t͡s oː k m oː k
cokol	t͡s o k o l
col	t͡s o l
colstok	t͡s o l ʃ t o k
comb	t͡s o m b
compó	t͡s o m p oː
