Grapheme	IPA
pogonya	p o ɡ o ɲ ɒ
poggyász	p o ɟː aː s
pohánka	p o h aː n k ɒ
pohár	p o h aː r
pohárnok	p o h aː r n o k
pohos	p o h o ʃ
pojáca	p o j aː t͡s ɒ
pojána	p o j aː n ɒ
pók	p oː k
póka	p oː k ɒ
póker	p oː k ɛ r
pokla	p o k l ɒ
pokróc	p o k r oː t͡s
pólaj	p oː l ɒ j
polc	p o l t͡s
polemikus	p o l ɛ m i k u ʃ
polemizál	p o l ɛ m i z aː l
polenta	p o l ɛ n t ɒ
polgár	p o l ɡ aː r
polha	p o l h ɒ
polhák	p o l h aː k
póling	p oː l i n ɡ
polip	p o l i p
politika	p o l i t i k ɒ
politúr	p o l i t uː r
polka	p o l k ɒ
póló	p oː l oː
poloska	p o l o ʃ k ɒ
poltura	p o l t u r ɒ
pólus	p oː l u ʃ
polyák	p o j aː k
pomádé	p o m aː d eː
pomagránát	p o m ɒ ɡ r aː n aː t
pomána	p o m aː n ɒ
pompa	p o m p ɒ
poncol	p o n t͡s o l
pondró	p o n d r oː
pongyola	p o n ɟ o l ɒ
póni	p oː n i
ponk	p o n k
pont	p o n t
ponton	p o n t o n
ponty	p o n c
pónyik	p oː ɲ i k
ponyva	p o ɲ v ɒ
pópa	p oː p ɒ
popó	p o p oː
popri	p o p r i
por	p o r
pór	p oː r
póráz	p oː r aː z
porc	p o r t͡s
porcelán	p o r t͡s ɛ l aː n
porcika	p o r t͡s i k ɒ
porció	p o r t͡s i oː
porcog	p o r t͡s o ɡ
porcan	p o r t͡s ɒ n
porcsin	p o r t͡ʃ i n
póré	p oː r eː
porgolát	p o r ɡ o l aː t
porhajas	p o r h ɒ j ɒ ʃ
porhanyó	p o r h ɒ ɲ oː
porkoláb	p o r k o l aː b
porond	p o r o n d
porong	p o r o n ɡ
poronty	p o r o n c
porosz	p o r o s
poroszka	p o r o s k ɒ
poroszló	p o r o s l oː
porta	p o r t ɒ
portéka	p o r t eː k ɒ
portó	p o r t oː
portré	p o r t r eː
portugál	p o r t u ɡ aː l
portuláka	p o r t u l aː k ɒ
portya	p o r c ɒ
pórus	p oː r u ʃ
poshad	p o ʃ h ɒ d
posta	p o ʃ t ɒ
posvány	p o ʃ v aː ɲ
poszáta	p o s aː t ɒ
poszmat	p o s m ɒ t
poszméh	p o s m eː h
poszog	p o s o ɡ
poszt	p o s t
potentát	p o t ɛ n t aː t
potom	p o t o m
potroh	p o t r o h
potyára	p o c aː r ɒ
potyán	p o c aː n
potyka	p o c k ɒ
potyol	p o c o l
pottyan	p o cː ɒ n
povedál	p o v ɛ d aː l
póz	p oː z
pozdorja	p o z d o r j ɒ
pozíció	p o z iː t͡s i oː
pozitívum	p o z i t iː v u m
pózna	p oː z n ɒ
pozsár	p o ʒ aː r
pozsgás	p o ʒ ɡ aː ʃ
pozslár	p o ʒ l aː r
pozsdul	p o ʒ d u l
pöce	p ø t͡s ɛ
pöcköl	p ø t͡s k ø l
pöcs	p ø t͡ʃ
pőcsik	p øː t͡ʃ i k
pöfeteg	p ø f ɛ t ɛ ɡ
pöfög	p ø f ø ɡ
pökhendi	p ø k h ɛ n d i
pörc	p ø r t͡s
pőre	p øː r ɛ
pörköl	p ø r k ø l
pörkölt	p ø r k ø l t
pöröly	p ø r ø j
pörsed	p ø r ʃ ɛ d
pöszméte	p ø s m eː t ɛ
pöszöget	p ø s ø ɡ ɛ t
pöttöm	p ø tː ø m
pötyög	p ø c ø ɡ
pőtyög	p øː c ø ɡ
pracli	p r ɒ t͡s l i
praktika	p r ɒ k t i k ɒ
praxis	p r ɒ k s i ʃ
praliné	p r ɒ l i n eː
pranda	p r ɒ n d ɒ
precíz	p r ɛ t͡s iː z
precizitás	p r ɛ t͡s i z i t aː ʃ
préda	p r eː d ɒ
prédikáció	p r eː d i k aː t͡s i oː
prelátus	p r ɛ l aː t u ʃ
prém	p r eː m
premier	p r ɛ m i ɛ r
prémium	p r eː m i u m
premontrei	p r ɛ m o n t r ɛ i
prepa	p r ɛ p ɒ
preparál	p r ɛ p ɒ r aː l
prépost	p r eː p o ʃ t
préri	p r eː r i
prés	p r eː ʃ
presbiter	p r ɛ ʃ b i t ɛ r
presztízs	p r ɛ s t iː ʒ
prézli	p r eː z l i
prézsmitál	p r eː ʒ m i t aː l
pribék	p r i b eː k
priccs	p r i t͡ʃː
prikulics	p r i k u l i t͡ʃ
prím	p r iː m
príma	p r iː m ɒ
primadonna	p r i m ɒ d o nː ɒ
prímás	p r iː m aː ʃ
primer	p r i m ɛ r
primitív	p r i m i t iː v
primőr	p r i m øː r
primula	p r i m u l ɒ
principális	p r i n t͡s i p aː l i ʃ
prior	p r i o r
privátim	p r i v aː t i m
privilégium	p r i v i l eː ɡ i u m
prizma	p r i z m ɒ
próbál	p r oː b aː l
próba	p r oː b ɒ
probléma	p r o b l eː m ɒ
produkál	p r o d u k aː l
profán	p r o f aː n
professzor	p r o f ɛ sː o r
prófétál	p r oː f eː t aː l
prófécia	p r oː f eː t͡s i ɒ
profi	p r o f i
profil	p r o f i l
profitíroz	p r o f i t iː r o z
profosz	p r o f o s
prófunt	p r oː f u n t
program	p r o ɡ r ɒ m
prókátor	p r oː k aː t o r
proletár	p r o l ɛ t aː r
prológus	p r o l oː ɡ u ʃ
prolongál	p r o l o n ɡ aː l
promenád	p r o m ɛ n aː d
propagál	p r o p ɒ ɡ aː l
propeller	p r o p ɛ lː ɛ r
proponál	p r o p o n aː l
prospektus	p r o ʃ p ɛ k t u ʃ
prostituál	p r o ʃ t i t u aː l
prostitúció	p r o ʃ t i t uː t͡s i oː
prósza	p r oː s ɒ
prosztata	p r o s t ɒ t ɒ
protekció	p r o t ɛ k t͡s i oː
protestál	p r o t ɛ ʃ t aː l
protestáns	p r o t ɛ ʃ t aː n ʃ
protézis	p r o t eː z i ʃ
protokoll	p r o t o k o lː
provinciális	p r o v i n t͡s i aː l i ʃ
provokál	p r o v o k aː l
provokáció	p r o v o k aː t͡s i oː
próza	p r oː z ɒ
pruszli	p r u s l i
pruszlik	p r u s l i k
prűd	p r yː d
prüszköl	p r y s k ø l
pszt	p s t
publikál	p u b l i k aː l
publikán	p u b l i k aː n
puca	p u t͡s ɒ
pucc	p u t͡sː
pucer	p u t͡s ɛ r
pucér	p u t͡s eː r
pucol	p u t͡s o l
puccs	p u t͡ʃː
púder	p uː d ɛ r
puding	p u d i n ɡ
pudli	p u d l i
pudvás	p u d v aː ʃ
pufajka	p u f ɒ j k ɒ
puff	p u fː
pufók	p u f oː k
puha	p u h ɒ
puhatol	p u h ɒ t o l
pukedli	p u k ɛ d l i
pukkan	p u kː ɒ n
pukkad	p u kː ɒ d
puli	p u l i
puliszka	p u l i s k ɒ
pulóver	p u l oː v ɛ r
pulpitus	p u l p i t u ʃ
pult	p u l t
pulzus	p u l z u ʃ
pulya	p u j ɒ
pulyka	p u j k ɒ
puma	p u m ɒ
pumli	p u m l i
pumpol	p u m p o l
pun	p u n
punci	p u n t͡s i
puncs	p u n t͡ʃ
punktum	p u n k t u m
púp	p uː p
pupák	p u p aː k
pupdenevér	p u p d ɛ n ɛ v eː r
pupilla	p u p i lː ɒ
puplin	p u p l i n
purdé	p u r d eː
purga	p u r ɡ ɒ
purgáció	p u r ɡ aː t͡s i oː
purgamál	p u r ɡ ɒ m aː l
purgatórium	p u r ɡ ɒ t oː r i u m
purgelejt	p u r ɡ ɛ l ɛ j t
puritán	p u r i t aː n
purparlé	p u r p ɒ r l eː
purpián	p u r p i aː n
puruttya	p u r u cː ɒ
purzsa	p u r ʒ ɒ
puska	p u ʃ k ɒ
pusmog	p u ʃ m o ɡ
puszedli	p u s ɛ d l i
puszi	p u s i
puszpáng	p u s p aː n ɡ
puszta	p u s t ɒ
pusztít	p u s t iː t
putina	p u t i n ɒ
putnok	p u t n o k
putri	p u t r i
puttony	p u tː o ɲ
puzdarék	p u z d ɒ r eː k
puzdra	p u z d r ɒ
púzsa	p uː ʒ ɒ
puzsér	p u ʒ eː r
püffed	p y fː ɛ d
püföl	p y f ø l
pünkösd	p y n k ø ʃ d
püré	p y r eː
püspök	p y ʃ p ø k
püspökfalat	p y ʃ p ø k f ɒ l ɒ t
rá	r aː
rab	r ɒ b
rabbi	r ɒ bː i
rabol	r ɒ b o l
rabota	r ɒ b o t ɒ
rabszolga	r ɒ b s o l ɡ ɒ
rác	r aː t͡s
ráció	r aː t͡s i oː
racionális	r ɒ t͡s i o n aː l i ʃ
racka	r ɒ t͡s k ɒ
rács	r aː t͡ʃ
raccsol	r ɒ t͡ʃː o l
radar	r ɒ d ɒ r
radikalizmus	r ɒ d i k ɒ l i z m u ʃ
rádió	r aː d i oː
radír	r ɒ d iː r
radíroz	r ɒ d iː r o z
rádium	r aː d i u m
rádli	r aː d l i
ráf	r aː f
rafia	r ɒ f i ɒ
rafiníroz	r ɒ f i n iː r o z
rafinált	r ɒ f i n aː l t
rag	r ɒ ɡ
rág	r aː ɡ
ragad	r ɒ ɡ ɒ d
ragasz	r ɒ ɡ ɒ s
rágalom	r aː ɡ ɒ l o m
raglán	r ɒ ɡ l aː n
ragu	r ɒ ɡ u
ragya	r ɒ ɟ ɒ
ragyiva	r ɒ ɟ i v ɒ
ragyog	r ɒ ɟ o ɡ
raj	r ɒ j
rája	r aː j ɒ
rajbol	r ɒ j b o l
rajcsúr	r ɒ j t͡ʃ uː r
rajkó	r ɒ j k oː
rajong	r ɒ j o n ɡ
rajta	r ɒ j t ɒ
rajzol	r ɒ j z o l
rak	r ɒ k
rák	r aː k
rakéta	r ɒ k eː t ɒ
rakett	r ɒ k ɛ tː
rákfene	r aː k f ɛ n ɛ
rakia	r ɒ k i ɒ
rakonca	r ɒ k o n t͡s ɒ
rakoncátlan	r ɒ k o n t͡s aː t l ɒ n
ráma	r aː m ɒ
ramaty	r ɒ m ɒ c
ramazúri	r ɒ m ɒ z uː r i
rámol	r aː m o l
rámpa	r aː m p ɒ
ránc	r aː n t͡s
ráncigál	r aː n t͡s i ɡ aː l
randalírozik	r ɒ n d ɒ l iː r o z i k
randevú	r ɒ n d ɛ v uː
rang	r ɒ n ɡ
ránkor	r aː n k o r
ránt	r aː n t
rántotta	r aː n t o tː ɒ
rapittyán	r ɒ p i cː aː n
rapli	r ɒ p l i
raponc	r ɒ p o n t͡s
raport	r ɒ p o r t
rapszódia	r ɒ p s oː d i ɒ
ráró	r aː r oː
ráspoly	r aː ʃ p o j
rásza	r aː s ɒ
rassz	r ɒ sː
rászt	r aː s t
ráta	r aː t ɒ
rátarti	r aː t ɒ r t i
ravasz	r ɒ v ɒ s
ravatal	r ɒ v ɒ t ɒ l
ráz	r aː z
razzia	r ɒ zː i ɒ
rázsa	r aː ʒ ɒ
reakció	r ɛ ɒ k t͡s i oː
reaktivál	r ɛ ɒ k t i v aː l
realitás	r ɛ ɒ l i t aː ʃ
rebarbara	r ɛ b ɒ r b ɒ r ɒ
rebeg	r ɛ b ɛ ɡ
rebellis	r ɛ b ɛ lː i ʃ
rébusz	r eː b u s
rece	r ɛ t͡s ɛ
réce	r eː t͡s ɛ
recece	r ɛ t͡s ɛ t͡s ɛ
recefice	r ɛ t͡s ɛ f i t͡s ɛ
receg	r ɛ t͡s ɛ ɡ
receptum	r ɛ t͡s ɛ p t u m
recseg	r ɛ t͡ʃ ɛ ɡ
redel	r ɛ d ɛ l
redős	r ɛ d øː ʃ
redukál	r ɛ d u k aː l
redves	r ɛ d v ɛ ʃ
referál	r ɛ f ɛ r aː l
reflektál	r ɛ f l ɛ k t aː l
reflektor	r ɛ f l ɛ k t o r
reflex	r ɛ f l ɛ k s
reforma	r ɛ f o r m ɒ
reformál	r ɛ f o r m aː l
reformátor	r ɛ f o r m aː t o r
refrén	r ɛ f r eː n
reg	r ɛ ɡ
rég	r eː ɡ
régenten	r eː ɡ ɛ n t ɛ n
regatta	r ɛ ɡ ɒ tː ɒ
rege	r ɛ ɡ ɛ
regény	r ɛ ɡ eː ɲ
regiment	r ɛ ɡ i m ɛ n t
régimódi	r eː ɡ i m oː d i
régió	r eː ɡ i oː
regisztrál	r ɛ ɡ i s t r aː l
reglama	r ɛ ɡ l ɒ m ɒ
regnál	r ɛ ɡ n aː l
regös	r ɛ ɡ ø ʃ
regruta	r ɛ ɡ r u t ɒ
regula	r ɛ ɡ u l ɒ
réja	r eː j ɒ
rejt	r ɛ j t
rekamié	r ɛ k ɒ m i eː
reked	r ɛ k ɛ d
rekeg	r ɛ k ɛ ɡ
rekenyő	r ɛ k ɛ ɲ øː
rekesz	r ɛ k ɛ s
regget	r ɛ ɡː ɛ t
rekettye	r ɛ k ɛ cː ɛ
reklám	r ɛ k l aː m
reklamál	r ɛ k l ɒ m aː l
rékli	r eː k l i
rekord	r ɛ k o r d
rekordál	r ɛ k o r d aː l
rektor	r ɛ k t o r
rekviem	r ɛ k v i ɛ m
rekvirál	r ɛ k v i r aː l
reláció	r ɛ l aː t͡s i oː
relativitás	r ɛ l ɒ t i v i t aː ʃ
remeg	r ɛ m ɛ ɡ
remek	r ɛ m ɛ k
remél	r ɛ m eː l
remény	r ɛ m eː ɲ
remese	r ɛ m ɛ ʃ ɛ
remete	r ɛ m ɛ t ɛ
remíz	r ɛ m iː z
remonda	r ɛ m o n d ɒ
rémül	r eː m y l
rend	r ɛ n d
rendkívül	r ɛ n d k iː v y l
rendőr	r ɛ n d øː r
rendszer	r ɛ n d s ɛ r
renegát	r ɛ n ɛ ɡ aː t
rénes	r eː n ɛ ʃ
reneszánsz	r ɛ n ɛ s aː n s
reng	r ɛ n ɡ
rengeteg	r ɛ n ɡ ɛ t ɛ ɡ
renovál	r ɛ n o v aː l
rénszarvas	r eː n s ɒ r v ɒ ʃ
rénye	r eː ɲ ɛ
renyhe	r ɛ ɲ h ɛ
répa	r eː p ɒ
reparál	r ɛ p ɒ r aː l
repce	r ɛ p t͡s ɛ
repcsény	r ɛ p t͡ʃ eː ɲ
reped	r ɛ p ɛ d
repetál	r ɛ p ɛ t aː l
repkény	r ɛ p k eː ɲ
replika	r ɛ p l i k ɒ
reprezentál	r ɛ p r ɛ z ɛ n t aː l
repül	r ɛ p y l
rér	r eː r
rés	r eː ʃ
respektus	r ɛ ʃ p ɛ k t u ʃ
respektál	r ɛ ʃ p ɛ k t aː l
respublika	r ɛ ʃ p u b l i k ɒ
rest	r ɛ ʃ t
restancia	r ɛ ʃ t ɒ n t͡s i ɒ
restaurál	r ɛ ʃ t ɒ u r aː l
rész	r eː s
részeg	r eː s ɛ ɡ
reszel	r ɛ s ɛ l
részére	r eː s eː r ɛ
reszket	r ɛ s k ɛ t
reszkíroz	r ɛ s k iː r o z
reszort	r ɛ s o r t
resztli	r ɛ s t l i
részvét	r eː s v eː t
rét	r eː t
réteg	r eː t ɛ ɡ
retek	r ɛ t ɛ k
reterát	r ɛ t ɛ r aː t
rétes	r eː t ɛ ʃ
retesz	r ɛ t ɛ s
retikül	r ɛ t i k y l
retirál	r ɛ t i r aː l
retten	r ɛ tː ɛ n
retúr	r ɛ t uː r
retyeg	r ɛ c ɛ ɡ
retyerutya	r ɛ c ɛ r u c ɒ
retyke	r ɛ c k ɛ
reuma	r ɛ u m ɒ
rév	r eː v
reváns	r ɛ v aː n ʃ
révén	r eː v eː n
reverenda	r ɛ v ɛ r ɛ n d ɒ
reverzális	r ɛ v ɛ r z aː l i ʃ
reves	r ɛ v ɛ ʃ
revízió	r ɛ v iː z i oː
revolver	r ɛ v o l v ɛ r
revü	r ɛ v y
révül	r eː v y l
révedezik	r eː v ɛ d ɛ z i k
rez	r ɛ z
réz	r eː z
rezeda	r ɛ z ɛ d ɒ
rezerva	r ɛ z ɛ r v ɒ
rezidencia	r ɛ z i d ɛ n t͡s i ɒ
reznek	r ɛ z n ɛ k
rezzeszt	r ɛ zː ɛ s t
rezdül	r ɛ z d y l
rezsi	r ɛ ʒ i
rezsim	r ɛ ʒ i m
rezsnyice	r ɛ ʒ ɲ i t͡s ɛ
rezsó	r ɛ ʒ oː
rézsút	r eː ʒ uː t
rí	r iː
rianás	r i ɒ n aː ʃ
riaszt	r i ɒ s t
riaszkodik	r i ɒ s k o d i k
riba	r i b ɒ
ribanc	r i b ɒ n t͡s
ribesz	r i b ɛ s
ribillió	r i b i lː i oː
ribiszke	r i b i s k ɛ
ribizli	r i b i z l i
richtig	r i h t i ɡ
ricinus	r i t͡s i n u ʃ
ricsaj	r i t͡ʃ ɒ j
rideg	r i d ɛ ɡ
rigli	r i ɡ l i
rigmus	r i ɡ m u ʃ
rigó	r i ɡ oː
rigolyás	r i ɡ o j aː ʃ
rigya	r i ɟ ɒ
rikácsol	r i k aː t͡ʃ o l
rikít	r i k iː t
rikolt	r i k o l t
rikongat	r i k o n ɡ ɒ t
rím	r iː m
rima	r i m ɒ
rimánkodik	r i m aː n k o d i k
ring	r i n ɡ
ringli	r i n ɡ l i
ringlispíl	r i n ɡ l i ʃ p iː l
ringló	r i n ɡ l oː
ringyó	r i n ɟ oː
rinocérosz	r i n o t͡s eː r o s
ripacs	r i p ɒ t͡ʃ
riport	r i p o r t
riposzt	r i p o s t
ripők	r i p øː k
ripszropsz	r i p s r o p s
riska	r i ʃ k ɒ
riszál	r i s aː l
ritka	r i t k ɒ
ritmus	r i t m u ʃ
rítus	r iː t u ʃ
rittyen	r i cː ɛ n
rivakodik	r i v ɒ k o d i k
rivalda	r i v ɒ l d ɒ
rivális	r i v aː l i ʃ
rivalizál	r i v ɒ l i z aː l
rivall	r i v ɒ lː
rizibizi	r i z i b i z i
rizike	r i z i k ɛ
rizikó	r i z i k oː
rizling	r i z l i n ɡ
rizottó	r i z o tː oː
rizs	r i ʒ
rizsma	r i ʒ m ɒ
ró	r oː
robog	r o b o ɡ
robot	r o b o t
isrobusztus	i ʃ r o b u s t u ʃ
rocska	r o t͡ʃ k ɒ
ródlizik	r oː d l i z i k
ródli	r oː d l i
rogyik	r o ɟ i k
roh	r o h
rohad	r o h ɒ d
roham	r o h ɒ m
rohan	r o h ɒ n
rohog	r o h o ɡ
rojt	r o j t
róka	r oː k ɒ
rókázik	r oː k aː z i k
rokk	r o kː
rokka	r o kː ɒ
rokkan	r o kː ɒ n
rokokó	r o k o k oː
rokolya	r o k o j ɒ
rokon	r o k o n
rokonszenv	r o k o n s ɛ n v
róla	r oː l ɒ
rolád	r o l aː d
roletta	r o l ɛ tː ɒ
roller	r o lː ɛ r
roló	r o l oː
rom	r o m
román	r o m aː n
románc	r o m aː n t͡s
romantika	r o m ɒ n t i k ɒ
romantikus	r o m ɒ n t i k u ʃ
rombol	r o m b o l
romlik	r o m l i k
romonya	r o m o ɲ ɒ
róna	r oː n ɒ
roncos	r o n t͡s o ʃ
roncsol	r o n t͡ʃ o l
ronda	r o n d ɒ
rondella	r o n d ɛ lː ɒ
rondó	r o n d oː
rongál	r o n ɡ aː l
rongyos	r o n ɟ o ʃ
rop	r o p
ropp	r o pː
roppant	r o pː ɒ n t
roráté	r o r aː t eː
rósejbni	r oː ʃ ɛ j b n i
roshad	r o ʃ h ɒ d
roskad	r o ʃ k ɒ d
roskatag	r o ʃ k ɒ t ɒ ɡ
rosseb	r o ʃː ɛ b
rost	r o ʃ t
rosta	r o ʃ t ɒ
rostély	r o ʃ t eː j
rostok	r o ʃ t o k
rossz	r o sː
rosszmájú	r o sː m aː j uː
róta	r oː t ɒ
rothad	r o t h ɒ d
rotyog	r o c o ɡ
rovancs	r o v ɒ n t͡ʃ
rovar	r o v ɒ r
rovat	r o v ɒ t
rozmár	r o z m aː r
rozmaring	r o z m ɒ r i n ɡ
rozzant	r o zː ɒ n t
rozzan	r o zː ɒ n
rozs	r o ʒ
rózsa	r oː ʒ ɒ
rózsakoszorú	r oː ʒ ɒ k o s o r uː
rózsafüzér	r oː ʒ ɒ f y z eː r
rózsaszínű	r oː ʒ ɒ s iː n yː
rozsda	r o ʒ d ɒ
rozsnok	r o ʒ n o k
rozsólis	r o ʒ oː l i ʃ
rozsomák	r o ʒ o m aː k
rőf	r øː f
röffen	r ø fː ɛ n
rög	r ø ɡ
rögbi	r ø ɡ b i
rögeszme	r ø ɡ ɛ s m ɛ
rögtön	r ø ɡ t ø n
röhög	r ø h ø ɡ
rökönyül	r ø k ø ɲ y l
römi	r ø m i
römpöly	r ø m p ø j
rönk	r ø n k
röntgen	r ø n t ɡ ɛ n
röstöl	r ø ʃ t ø l
rőt	r øː t
rövid	r ø v i d
rőzse	r øː ʒ ɛ
rubel	r u b ɛ l
rubin	r u b i n
rubrika	r u b r i k ɒ
ruca	r u t͡s ɒ
ruccan	r u t͡sː ɒ n
rúd	r uː d
rúg	r uː ɡ
ruga	r u ɡ ɒ
ruha	r u h ɒ
rukkol	r u kː o l
rulett	r u l ɛ tː
rum	r u m
rumli	r u m l i
rusnya	r u ʃ ɲ ɒ
ruszki	r u s k i
ruszli	r u s l i
rusznyák	r u s ɲ aː k
rusztikus	r u s t i k u ʃ
rút	r uː t
ruta	r u t ɒ
rutén	r u t eː n
rutin	r u t i n
rúzs	r uː ʒ
rücsköl	r y t͡ʃ k ø l
rücsök	r y t͡ʃ ø k
rügy	r y ɟ
rüh	r y h
sátán	ʃ aː t aː n
satíroz	ʃ ɒ t iː r o z
satnyít	ʃ ɒ t ɲ iː t
satnyul	ʃ ɒ t ɲ u l
satrantyú	ʃ ɒ t r ɒ n c uː
satu	ʃ ɒ t u
sav	ʃ ɒ v
savó	ʃ ɒ v oː
sávos	ʃ aː v o ʃ
se	ʃ ɛ
seb	ʃ ɛ b
sebbellobbal	ʃ ɛ bː ɛ lː o bː ɒ l
sebes	ʃ ɛ b ɛ ʃ
séd	ʃ eː d
sédó	ʃ eː d oː
séfely	ʃ eː f ɛ j
seft	ʃ ɛ f t
ség	ʃ eː ɡ
segéd	ʃ ɛ ɡ eː d
segg	ʃ ɛ ɡː
sehonnai	ʃ ɛ h o nː ɒ i
sej	ʃ ɛ j
sejdít	ʃ ɛ j d iː t
sejk	ʃ ɛ j k
sejt	ʃ ɛ j t
sekély	ʃ ɛ k eː j
sekrestye	ʃ ɛ k r ɛ ʃ c ɛ
selejt	ʃ ɛ l ɛ j t
sellő	ʃ ɛ lː øː
selma	ʃ ɛ l m ɒ
selyemfiú	ʃ ɛ j ɛ m f i uː
selyp	ʃ ɛ j p
sem	ʃ ɛ m
séma	ʃ eː m ɒ
sematikus	ʃ ɛ m ɒ t i k u ʃ
sémi	ʃ eː m i
semling	ʃ ɛ m l i n ɡ
semlyék	ʃ ɛ m j eː k
semmi	ʃ ɛ mː i
semmiházi	ʃ ɛ mː i h aː z i
senkel	ʃ ɛ n k ɛ l
senki	ʃ ɛ n k i
senye	ʃ ɛ ɲ ɛ
senyved	ʃ ɛ ɲ v ɛ d
seped	ʃ ɛ p ɛ d
serbli	ʃ ɛ r b l i
serceg	ʃ ɛ r t͡s ɛ ɡ
sercint	ʃ ɛ r t͡s i n t
sercli	ʃ ɛ r t͡s l i
serdül	ʃ ɛ r d y l
seregély	ʃ ɛ r ɛ ɡ eː j
serény	ʃ ɛ r eː ɲ
seriff	ʃ ɛ r i fː
sérikál	ʃ eː r i k aː l
serít	ʃ ɛ r iː t
serke	ʃ ɛ r k ɛ
serkent	ʃ ɛ r k ɛ n t
serleg	ʃ ɛ r l ɛ ɡ
serpenyő	ʃ ɛ r p ɛ ɲ øː
sért	ʃ eː r t
serte	ʃ ɛ r t ɛ
sertély	ʃ ɛ r t eː j
sertepertél	ʃ ɛ r t ɛ p ɛ r t eː l
sertés	ʃ ɛ r t eː ʃ
sérvés	ʃ eː r v eː ʃ
sestély	ʃ ɛ ʃ t eː j
sétál	ʃ eː t aː l
sétány	ʃ eː t aː ɲ
settenkedik	ʃ ɛ tː ɛ n k ɛ d i k
sezlon	ʃ ɛ z l o n
sí	ʃ iː
síber	ʃ iː b ɛ r
sicc	ʃ i t͡sː
siet	ʃ i ɛ t
sifli	ʃ i f l i
sifonér	ʃ i f o n eː r
sifon	ʃ i f o n
siheder	ʃ i h ɛ d ɛ r
sablon	ʃ ɒ b l o n
saccol	ʃ ɒ t͡sː o l
sáf	ʃ aː f
sáfár	ʃ aː f aː r
safarina	ʃ ɒ f ɒ r i n ɒ
sáfó	ʃ aː f oː
sáfrány	ʃ aː f r aː ɲ
ság	ʃ aː ɡ
sah	ʃ ɒ h
sája	ʃ aː j ɒ
saját	ʃ ɒ j aː t
sajdít	ʃ ɒ j d iː t
sajéta	ʃ ɒ j eː t ɒ
sajka	ʃ ɒ j k ɒ
sajnál	ʃ ɒ j n aː l
sajnos	ʃ ɒ j n o ʃ
sajt	ʃ ɒ j t
sajtár	ʃ ɒ j t aː r
sajtó	ʃ ɒ j t oː
sakál	ʃ ɒ k aː l
sakk	ʃ ɒ kː
sakkmatt	ʃ ɒ kː m ɒ tː
sakter	ʃ ɒ k t ɛ r
sál	ʃ aː l
salabakter	ʃ ɒ l ɒ b ɒ k t ɛ r
salagvárda	ʃ ɒ l ɒ ɡ v aː r d ɒ
salak	ʃ ɒ l ɒ k
salap	ʃ ɒ l ɒ p
salapál	ʃ ɒ l ɒ p aː l
saláta	ʃ ɒ l aː t ɒ
salavári	ʃ ɒ l ɒ v aː r i
salétrom	ʃ ɒ l eː t r o m
sallang	ʃ ɒ lː ɒ n ɡ
sámán	ʃ aː m aː n
samesz	ʃ ɒ m ɛ s
sámfa	ʃ aː m f ɒ
sámli	ʃ aː m l i
samott	ʃ ɒ m o tː
sampinyon	ʃ ɒ m p i ɲ o n
sampon	ʃ ɒ m p o n
sánc	ʃ aː n t͡s
sandalnsz	ʃ ɒ n d ɒ l n s
sansz	ʃ ɒ n s
sánta	ʃ aː n t ɒ
sanzon	ʃ ɒ n z o n
sanyargat	ʃ ɒ ɲ ɒ r ɡ ɒ t
sáp	ʃ aː p
sápad	ʃ aː p ɒ d
sapka	ʃ ɒ p k ɒ
sápkór	ʃ aː p k oː r
sáposkodik	ʃ aː p o ʃ k o d i k
sár	ʃ aː r
sarabol	ʃ ɒ r ɒ b o l
sárarany	ʃ aː r ɒ r ɒ ɲ
sarcol	ʃ ɒ r t͡s o l
sárfatil	ʃ aː r f ɒ t i l
sárga	ʃ aː r ɡ ɒ
sarha	ʃ ɒ r h ɒ
sárhodik	ʃ aː r h o d i k
sarj	ʃ ɒ r j
sarkall	ʃ ɒ r k ɒ lː
sarkantyú	ʃ ɒ r k ɒ n c uː
sárkány	ʃ aː r k aː ɲ
sarlatán	ʃ ɒ r l ɒ t aː n
sarló	ʃ ɒ r l oː
sárma	ʃ aː r m ɒ
sármálú	ʃ aː r m aː l uː
sármenta	ʃ aː r m ɛ n t ɒ
saroglya	ʃ ɒ r o ɡ j ɒ
sarzsi	ʃ ɒ r ʒ i
sas	ʃ ɒ ʃ
sás	ʃ aː ʃ
sashudik	ʃ ɒ ʃ h u d i k
sáska	ʃ aː ʃ k ɒ
sasszeg	ʃ ɒ sː ɛ ɡ
saszla	ʃ ɒ s l ɒ
sasszé	ʃ ɒ sː eː
sík	ʃ iː k
sikamlós	ʃ i k ɒ m l oː ʃ
sikár	ʃ i k aː r
sikátor	ʃ i k aː t o r
sikattyú	ʃ i k ɒ cː uː
siker	ʃ i k ɛ r
sikeretlen	ʃ i k ɛ r ɛ t l ɛ n
sikér	ʃ i k eː r
sikk	ʃ i kː
sikkaszt	ʃ i kː ɒ s t
sikolt	ʃ i k o l t
silabizál	ʃ i l ɒ b i z aː l
silány	ʃ i l aː ɲ
siláp	ʃ i l aː p
silbak	ʃ i l b ɒ k
sild	ʃ i l d
siller	ʃ i lː ɛ r
silling	ʃ i lː i n ɡ
siló	ʃ i l oː
sima	ʃ i m ɒ
simul	ʃ i m u l
símely	ʃ iː m ɛ j
simfel	ʃ i m f ɛ l
simléder	ʃ i m l eː d ɛ r
sín	ʃ iː n
sincs	ʃ i n t͡ʃ
sindik	ʃ i n d i k
sing	ʃ i n ɡ
sinkófál	ʃ i n k oː f aː l
sinkózik	ʃ i n k oː z i k
sintér	ʃ i n t eː r
sió	ʃ i oː
síp	ʃ iː p
sípcsont	ʃ iː p t͡ʃ o n t
sipít	ʃ i p iː t
sipőc	ʃ i p øː t͡s
sír	ʃ iː r
sirály	ʃ i r aː j
sirokkó	ʃ i r o kː oː
siseg	ʃ i ʃ ɛ ɡ
siserehad	ʃ i ʃ ɛ r ɛ h ɒ d
siska	ʃ i ʃ k ɒ
sit	ʃ i t
sittel	ʃ i tː ɛ l
sivalkodik	ʃ i v ɒ l k o d i k
sivár	ʃ i v aː r
sivatag	ʃ i v ɒ t ɒ ɡ
sívó	ʃ iː v oː
skála	ʃ k aː l ɒ
skalp	ʃ k ɒ l p
skandál	ʃ k ɒ n d aː l
skandalum	ʃ k ɒ n d ɒ l u m
skandináv	ʃ k ɒ n d i n aː v
skarablya	ʃ k ɒ r ɒ b j ɒ
skarlát	ʃ k ɒ r l aː t
skart	ʃ k ɒ r t
skatulya	ʃ k ɒ t u j ɒ
skicc	ʃ k i t͡sː
skíz	ʃ k iː z
skófium	ʃ k oː f i u m
skorbut	ʃ k o r b u t
skorpió	ʃ k o r p i oː
skót	ʃ k oː t
skrupulus	ʃ k r u p u l u ʃ
slafrok	ʃ l ɒ f r o k
slag	ʃ l ɒ ɡ
sláger	ʃ l aː ɡ ɛ r
slájm	ʃ l aː j m
slamasztika	ʃ l ɒ m ɒ s t i k ɒ
slampet	ʃ l ɒ m p ɛ t
slendrián	ʃ l ɛ n d r i aː n
slepp	ʃ l ɛ pː
slicc	ʃ l i t͡sː
sligovica	ʃ l i ɡ o v i t͡s ɒ
slisszol	ʃ l i sː o l
slukk	ʃ l u kː
slussz	ʃ l u sː
smaci	ʃ m ɒ t͡s i
smafu	ʃ m ɒ f u
smakkol	ʃ m ɒ kː o l
smaragd	ʃ m ɒ r ɒ ɡ d
smarni	ʃ m ɒ r n i
sminkel	ʃ m i n k ɛ l
smirgli	ʃ m i r ɡ l i
smírol	ʃ m iː r o l
smonca	ʃ m o n t͡s ɒ
smucig	ʃ m u t͡s i ɡ
smukk	ʃ m u kː
snájdig	ʃ n aː j d i ɡ
snapsz	ʃ n ɒ p s
snapszli	ʃ n ɒ p s l i
snassz	ʃ n ɒ sː
sneff	ʃ n ɛ fː
snidling	ʃ n i d l i n ɡ
sód	ʃ oː d
sódar	ʃ oː d ɒ r
sóder	ʃ oː d ɛ r
sodó	ʃ o d oː
sodrony	ʃ o d r o ɲ
sofőr	ʃ o f øː r
sógor	ʃ oː ɡ o r
soha	ʃ o h ɒ
sóhajt	ʃ oː h ɒ j t
sóher	ʃ oː h ɛ r
sóhivatal	ʃ oː h i v ɒ t ɒ l
sok	ʃ o k
sokác	ʃ o k aː t͡s
sokk	ʃ o kː
sólet	ʃ oː l ɛ t
soltész	ʃ o l t eː s
sólya	ʃ oː j ɒ
som	ʃ o m
somfordál	ʃ o m f o r d aː l
sompolyodik	ʃ o m p o j o d i k
sompolyog	ʃ o m p o j o ɡ
sonka	ʃ o n k ɒ
sonkoly	ʃ o n k o j
sop	ʃ o p
sopánkodik	ʃ o p aː n k o d i k
sopár	ʃ o p aː r
sor	ʃ o r
sórál	ʃ oː r aː l
sordély	ʃ o r d eː j
sorol	ʃ o r o l
sorompó	ʃ o r o m p oː
sors	ʃ o r ʃ
sort	ʃ o r t
sorvad	ʃ o r v ɒ d
sósav	ʃ oː ʃ ɒ v
sóska	ʃ oː ʃ k ɒ
sovány	ʃ o v aː ɲ
sovinizmus	ʃ o v i n i z m u ʃ
sömörgőzik	ʃ ø m ø r ɡ øː z i k
söntés	ʃ ø n t eː ʃ
sör	ʃ ø r
sörbet	ʃ ø r b ɛ t
sőre	ʃ øː r ɛ
sőreg	ʃ øː r ɛ ɡ
sörény	ʃ ø r eː ɲ
sörét	ʃ ø r eː t
sőt	ʃ øː t
sötét	ʃ ø t eː t
sövény	ʃ ø v eː ɲ
spádé	ʃ p aː d eː
spagát	ʃ p ɒ ɡ aː t
spagetti	ʃ p ɒ ɡ ɛ tː i
spágó	ʃ p aː ɡ oː
spájz	ʃ p aː j z
spaletta	ʃ p ɒ l ɛ tː ɒ
spanyol	ʃ p ɒ ɲ o l
spárga	ʃ p aː r ɡ ɒ
sparhelt	ʃ p ɒ r h ɛ l t
speciális	ʃ p ɛ t͡s i aː l i ʃ
specializál	ʃ p ɛ t͡s i ɒ l i z aː l
spék	ʃ p eː k
spekulál	ʃ p ɛ k u l aː l
spenót	ʃ p ɛ n oː t
spicc	ʃ p i t͡sː
spicli	ʃ p i t͡s l i
spikanárd	ʃ p i k ɒ n aː r d
spiné	ʃ p i n eː
spinét	ʃ p i n eː t
spion	ʃ p i o n
spirál	ʃ p i r aː l
spirális	ʃ p i r aː l i ʃ
spiritiszta	ʃ p i r i t i s t ɒ
spiritusz	ʃ p i r i t u s
spongya	ʃ p o n ɟ ɒ
spontán	ʃ p o n t aː n
spóra	ʃ p oː r ɒ
spórol	ʃ p oː r o l
sport	ʃ p o r t
spriccer	ʃ p r i t͡sː ɛ r
sprőd	ʃ p r øː d
srác	ʃ r aː t͡s
srapnel	ʃ r ɒ p n ɛ l
srég	ʃ r eː ɡ
sróf	ʃ r oː f
stabilizál	ʃ t ɒ b i l i z aː l
stabil	ʃ t ɒ b i l
stáció	ʃ t aː t͡s i oː
stadion	ʃ t ɒ d i o n
stádium	ʃ t aː d i u m
staféta	ʃ t ɒ f eː t ɒ
stafíroz	ʃ t ɒ f iː r o z
stájer	ʃ t aː j ɛ r
stallum	ʃ t ɒ lː u m
stampedli	ʃ t ɒ m p ɛ d l i
stand	ʃ t ɒ n d
stanicli	ʃ t ɒ n i t͡s l i
start	ʃ t ɒ r t
statárium	ʃ t ɒ t aː r i u m
statáriális	ʃ t ɒ t aː r i aː l i ʃ
statisztika	ʃ t ɒ t i s t i k ɒ
statuál	ʃ t ɒ t u aː l
státus	ʃ t aː t u ʃ
stég	ʃ t eː ɡ
stelázsi	ʃ t ɛ l aː ʒ i
stempely	ʃ t ɛ m p ɛ j
stempli	ʃ t ɛ m p l i
stencil	ʃ t ɛ n t͡s i l
steppe	ʃ t ɛ pː ɛ
steril	ʃ t ɛ r i l
stikában	ʃ t i k aː b ɒ n
stikli	ʃ t i k l i
stilét	ʃ t i l eː t
stílus	ʃ t iː l u ʃ
stimmel	ʃ t i mː ɛ l
stóla	ʃ t oː l ɒ
stopli	ʃ t o p l i
stopper	ʃ t o pː ɛ r
stoppol	ʃ t o pː o l
stószol	ʃ t oː s o l
stráf	ʃ t r aː f
stráfkocsi	ʃ t r aː f k o t͡ʃ i
strájfa	ʃ t r aː j f ɒ
stramm	ʃ t r ɒ mː
strand	ʃ t r ɒ n d
strapáca	ʃ t r ɒ p aː t͡s ɒ
strapacíroz	ʃ t r ɒ p ɒ t͡s iː r o z
strázsa	ʃ t r aː ʒ ɒ
stréber	ʃ t r eː b ɛ r
strici	ʃ t r i t͡s i
strimf	ʃ t r i m f
strófa	ʃ t r oː f ɒ
strucc	ʃ t r u t͡sː
struccpolitika	ʃ t r u t͡sː p o l i t i k ɒ
strúma	ʃ t r uː m ɒ
stuccol	ʃ t u t͡sː o l
stucli	ʃ t u t͡s l i
stúdió	ʃ t uː d i oː
stúdium	ʃ t uː d i u m
stukatúr	ʃ t u k ɒ t uː r
suba	ʃ u b ɒ
subica	ʃ u b i t͡s ɒ
sublót	ʃ u b l oː t
sudamlik	ʃ u d ɒ m l i k
sudár	ʃ u d aː r
sui	ʃ u i
súg	ʃ uː ɡ
sugár	ʃ u ɡ aː r
suhanc	ʃ u h ɒ n t͡s
suhancár	ʃ u h ɒ n t͡s aː r
suharc	ʃ u h ɒ r t͡s
suhog	ʃ u h o ɡ
sújt	ʃ uː j t
sukk	ʃ u kː
sukoró	ʃ u k o r oː
suli	ʃ u l i
sullog	ʃ u lː o ɡ
súly	ʃ uː j
sumák	ʃ u m aː k
summa	ʃ u mː ɒ
sundámbundám	ʃ u n d aː m b u n d aː m
sunyik	ʃ u ɲ i k
superlát	ʃ u p ɛ r l aː t
suprál	ʃ u p r aː l
surc	ʃ u r t͡s
surgyé	ʃ u r ɟ eː
surján	ʃ u r j aː n
surmó	ʃ u r m oː
surrog	ʃ u rː o ɡ
suskus	ʃ u ʃ k u ʃ
susnya	ʃ u ʃ ɲ ɒ
susog	ʃ u ʃ o ɡ
suszter	ʃ u s t ɛ r
suta	ʃ u t ɒ
suttog	ʃ u tː o ɡ
sutton	ʃ u tː o n
suttyan	ʃ u cː ɒ n
suttyó	ʃ u cː oː
suttyomban	ʃ u cː o m b ɒ n
suvad	ʃ u v ɒ d
suviksz	ʃ u v i k s
sügér	ʃ y ɡ eː r
süket	ʃ y k ɛ t
süly	ʃ y j
süllyed	ʃ y jː ɛ d
sün	ʃ y n
sündörködik	ʃ y n d ø r k ø d i k
süpped	ʃ y pː ɛ d
sürgöny	ʃ y r ɡ ø ɲ
süsétek	ʃ y ʃ eː t ɛ k
süsü	ʃ y ʃ y
süt	ʃ y t
sütnivaló	ʃ y t n i v ɒ l oː
süveg	ʃ y v ɛ ɡ
süvölt	ʃ y v ø l t
süvölvény	ʃ y v ø l v eː ɲ
sváb	ʃ v aː b
svábbogár	ʃ v aː bː o ɡ aː r
sváda	ʃ v aː d ɒ
svadron	ʃ v ɒ d r o n
svéd	ʃ v eː d
svihák	ʃ v i h aː k
svindler	ʃ v i n d l ɛ r
svung	ʃ v u n ɡ
szab	s ɒ b
szabad	s ɒ b ɒ d
szabadkőműves	s ɒ b ɒ d k øː m yː v ɛ ʃ
szabadlábra	s ɒ b ɒ d l aː b r ɒ
szabados	s ɒ b ɒ d o ʃ
szabály	s ɒ b aː j
szabatos	s ɒ b ɒ t o ʃ
szablya	s ɒ b j ɒ
szabódik	s ɒ b oː d i k
szabotál	s ɒ b o t aː l
szacharin	s ɒ h ɒ r i n
szád	s aː d
szadizmus	s ɒ d i z m u ʃ
