ID	CONCEPTICON_ID	CONCEPTICON_GLOSS	FORM	MEANING	SENSE	SENSE_ID
932	2504	DIFFERENT	külön	  allein; einzeln;   einzeln;  Sonder-;   besonder;   abgesondert;   abgesondert;   besonders;  extra;   verschieden;  ungleich;   eigen	  verschieden	verschieden-1
933	2504	DIFFERENT	különb	  Unterschied;  abweichend; vorzüglicher;  besser;   verschieden;   verschiedenartig;   Abwechslung	  verschieden	verschieden-2
935	1418	DIG	ásvány	Graben;   Ausgegrabenes;  Grabgut;   Mineral;   überaltetes Ding	Graben	Graben-2
936	1418	DIG	vápa	 Grube; Graben;  Moor;   Pfütze;   Vertiefung;  Höhlung	Graben	Graben-9
941	2077	DILIGENT	serény	 tüchtig;  wachsam; flink;   munter;  geschickt;  klug;   nicht säumend;  willfährig;   fleißig;  strebsam;   schnelle Auffassung habend	  fleißig	fleiig-1
942	2077	DILIGENT	szorgalom	  sorgfältig;   Sorge;   Sorge;   Sorge;   Sorge;   eifrig;   sich ängstigen;   aneifern;   sich befleißigen; Fürsorge;   Eifer;   fleißig;   fleißig;   besorgt;  Besorgnis;  Besorgnis;   Fleiß;   Fleiß;   Fleiß;   sorgsam;   sorgsam	  fleißig	fleiig-2
945	25	DIRT	gaz	  Bodensatz;   niederträchtig;  böse;   Mist; wald;   Unkrautpflanze;  Schmutz;   Schmutz;   Spreu;  Stroh;  Heu;  Afterkorn;  Schurkerei	 Schmutz	Schmutz-1
946	25	DIRT	gaz	  Bodensatz;   niederträchtig;  böse;   Mist; wald;   Unkrautpflanze;  Schmutz;   Schmutz;   Spreu;  Stroh;  Heu;  Afterkorn;  Schurkerei	  Schmutz	Schmutz-2
956	1230	DIRTY	csatakos	 schmutzig; quatschnaß	 schmutzig	schmutzig-2
957	1230	DIRTY	csoda	  sehr;  schmutzig;   häßlich; Wunder;   Ungetüm;  Monstrum;   lobenswerte Tat;  Tugend;   Verwunderung;   Verdruß;   〈in heftigen Ausdrücken mit verblaßter Bedeutung〉;   wunderbar;  außerordentlich;   bewundern;   fürmerkwürdig halten;   für merkwürdig halten;   sich wundern	 schmutzig	schmutzig-3
980	485	DISAPPEAR	enyészik	 klein;  sich verbergen;   verbergen; verschwinden;   schwach werden;  kraftlos werden;   verwesen;  vernichtet werden;   Sonnenuntergang;   Verfall;   verschwindend wenig	verschwinden	verschwinden-1
982	485	DISAPPEAR	kallódik	  verschwinden; schwinden;  allmählich ausgehen;  abgehen 〈Ware〉;   gestoßen od herumgeworfen werden;   durch Walken verfilzt werden;   beschädigt werden;  abhanden kommen;  verlorengehen;   im Leben nicht zurechtkommen 〈Person〉	  verschwinden	verschwinden-3
988	1986	DISEASE	baj	  Angelegenheit; Kampf;  Zweikampf;   Ort des Zweikampfes;   Sorge;   Beschwerlichkeit;  Plackerei;   Krankheit;  Defekt;   Menstruation;   Notdurft;   Hinderniss	  Krankheit	Krankheit-1
989	1986	DISEASE	dög	  zugrunde gehen; Krankheit;  kaputtgehen;   sehr;   zugrunde richten;  Seuche;   Leiche;   Aas;   lebendes Tier 〈bes Hund;  Pferd〉;   niederträchtiger Mensch;   Unmenge;   Prachtweib;   Bestie;   in Versuchung bringen;   zunichte werden;   Schinder;   Mediziner	Krankheit	Krankheit-2
995	481	DISH	eledel	 Nahrung;  Lebensmittel; Speise	Speise	Speise-1
996	481	DISH	kaja	Speise;  Fressalien	Speise	Speise-4
999	2883	DISTURB	bódít	belästigen;  beschwindeln;  stören;   jmdn um den Verstand bringen;   betäuben;  abmatten	 stören	storen-2
1000	2883	DISTURB	habar	 belästigen;   plappern;   stören;  beschleunigen;   sich in jmdn vernarren; quirlen;  umtühren 〈in eine Speise〉 einrühren;   sich beeilen;  blubbern;  kavarófa;  a ló felső ajka;  száj;   sich streiten	  stören	storen-3
1008	119	DIVE	bújik	  Vorwand; sich verbergen;   hineindringen in etw;   tauchen;   sich in etw vertiefen;   schlüpfen 〈in ein Kleidungsstück〉;   aufgehen 〈Pflanze〉;   Verbannter;   Ausweg	  tauchen	tauchen-1
1009	119	DIVE	bukik	 stürzen;   fallen; tauchen;   eine Niederlage erleiden;   auf etw stoßen;   die führende Rolle verlieren;   fallieren;   zu Fall kommen;   durchfallen 〈in einem Unterrichtsfach〉;   der Polizei in die Hände fallen;   erpicht sein	tauchen	tauchen-2
1012	1119	DIVIDE	szakaszt	 absondern; zerfressen;   nehmen;   hinrichten;  verätzen;   reißen 〈trans〉;   entzweien 〈Gemeinschaft〉;  teilen;   ein Ende machen;  unterbrechen;   pflücken 〈Obst;  Blume〉;   〈Brotteig〉 auswirken;   erübrigen 〈Zeit〉;   Backkorb;  szakított;  tépett;   ganz ähnlich	 teilen	teilen-1
1014	813	DO	cihelődik	sich unruhig benehmen;   sich langsam aufrappeln;  etw langsam ausführen;  tun	 tun	tun-2
1015	813	DO	cselekedik	 tun; handeln	 tun	tun-3
1021	2009	DOG	csille	  Floß;  -hund; leichter Wagen;   Wagenladung;   Heuhaufen;  Kahn;   Förderwagen	 -hund	hund-2
1022	2009	DOG	eb	Hund;   niederträchtiger Kerl;   Hunde-;  Hun-;  hündisch	Hund	Hund-1
1026	1659	DOLL	alak¹	  Gestalt; Puppe;  Docke;   Maske;   Liebchen;  Form;   verziert;   Gaukler;  Komödiant 	Puppe	Puppe-1
1027	1659	DOLL	bábu	Puppe;   Kegel;  Figur 〈in versch Spielen〉;   Marionette 〈pejor〉 	Puppe	Puppe-2
1030	196	DONATE	ad	zukommen lassen;  schenken;   geben;  liefern;   lassen;   verkaufen;   veröffentlichen;   Geben;   Beleg;  Angabe;   Gesetzgeber;   Herausgeber;   〈als Teil eines Schimpfw〉;   Tradition;   Beitrag 	 schenken	schenken-1
1031	1567	DOOR	ajtó	Tür; Tür;  ajtóőriző;   öffnen	Tür	Tur-1
1032	1567	DOOR	ajtó	Tür; Tür;  ajtóőriző;   öffnen	Tür	Tur-2
1034	1326	DOWN	alá	abwärts;   unten;   darunter;   hinunter;   für;   unterhalb 	abwärts	abwarts-1
1035	1326	DOWN	fityeg	 herabhängen;  bummeln; hinab-;   die Daumen drehen;   hängender Schmuck;  Ohrring	hinab-	hinab-1
1039	2030	DRAG	hord	   ertragen;  schleppen; tragen;    tragen;   ähneln;  gleichen;    verbreiten;   umherbringen;   tragen 〈Schußwaffe〉;   im Leibe tragen 〈Schwangere die Frucht〉	 schleppen	schleppen-2
1040	2030	DRAG	hurcol	  schleppen;  verschleppen;   verunglimpfen;   herumtragen	  schleppen	schleppen-3
1042	93	DRAW MILK	fej¹	  saugen; melken;   abdringen 〈Geld〉	melken	melken-1
1043	2374	DREAM	álom	Traum;   Schlaf;   Einschlafen 	Traum	Traum-1
1044	814	DRESS UP	öltözik	 Hülle;   Kleidung;   Ankleideraum; sich kleiden;   eine bestimmte Art Kleidung tragen;   in einen geistlichen Orden eintreten;   ankleiden;   einen charakteristischen Zug;  eine Eigenschaft annehmen;   sich verkleiden	  ankleiden	ankleiden-1
1045	1401	DRINK	iszik	 Getränk;   Getränk;   Kneipe;   Trunkenbold;   flüssig;   vor Durst; trinken;    in sich ziehen;   einsaugen;   gierig genießen;   trunksüchtig sein;   die Linie berühren;  auf die Linie fallen 〈in manchen Spielen〉;   Tränke;   Tränke;   Trinken;   Trinken;   Trinker;  ohne Trinken;   angeheitert;  betrunken;   Lösch-;   Fließpapier	trinken	trinken-1
1046	1401	DRINK	piál	 trinken	 trinken	trinken-2
1049	741	DRIVE	dirigál	lenken;  richten;   verwalten;  Befehle austeilen;   dirigieren 〈einen Chor;  ein Orcheste〉	lenken	lenken-1
1050	741	DRIVE	fordít	 lenken;  richten;   benützen; bekehren;   kehren;  wenden;   ändern;    umwenden;   vergüten;  ersetzen;   übersetzen;  übertragen;   umdrehen;  verwenden;   auf etw beziehen;   Wendung;   Übersetzung;   Türangel;   Übersetzer	 lenken	lenken-2
1064	2868	DRIVE (CATTLE)	csap¹	  lassen; schlagen;  Unterhaltung〉;   Dolch;  stibitzen;   hauen;   streichen 〈Maß〉;   zupfen 〈Wolle〉;  reißen;   schleudern;  hinstoßen;   dringen;   tünchen;   eine andere Richtung einschlagen;   herabschießen auf etw;   schmeicheln;   treiben;   veranstalten 〈Festmahl;  Lärm schlagen;   klauen;   Schlag;   Unglück;   Spur;   gedrückt voll 〈Maß〉;   um sich herumschlagen;   neckisch;   Flattergeist	  treiben	treiben-1
1065	2868	DRIVE (CATTLE)	folytat	 treiben;   fließen lassen; eilen;   führen;  ausüben;   fortsetzen	 treiben	treiben-2
1073	3748	DROP (OF A LIQUID)	csepp	Tropfen;   ein Bißchen;   Tupfen	Tropfen	Tropfen-1
1074	3748	DROP (OF A LIQUID)	cseppen	  Tropfen; 〈einmal〉 tropfen;   es fällt für ihn etw ab;   hineinfallen	  Tropfen	Tropfen-2
1075	2866	DROP (SOMETHING)	ejt	  verursachen; zu Fall bringen;  im Kampf fällen;   in einen Zustand versetzen;   fallenlassen;   aussprechen;   sieben;   bei jmdm od an etw vorbeikommen	  fallenlassen	fallenlassen-1
1076	2866	DROP (SOMETHING)	esik	  ungeschickt;   Fall;   〈in einen Zustand〉 kommen;  flehen;  Maß〉;  stürzen; fallen;  fallen;   es regnet;  liegen;   fallen lassen;   Sonnenuntergang;   befallen;  bedecken;  geraten;   geschehen;   auf die Knie fallen;   den Tod finden;  es schneit;  es hagelt usw;   jmdm zuteil werden;   〈einem irgendwie〉 schmecken;  behagen;   sein;   hineindrängen;   sich auf jmdn stürzen;   sich erbarmen;   abnehmen 〈Menge;   Kasus;   ohne Fall;   vergänglich	  fallen lassen	fallenlassen-2
1080	1398	DRY	ösztövér	 schmal; mager;  dürr;   dünn;   trocken;  ermattet;   scheu 〈Pferd〉;   abgemergelt	  trocken	trocken-2
1081	1398	DRY	száraz	  mager;  zehrend 〈Krankheit〉;  dürr;   nackt; trocken;   Boden;  Festland;  Verhalten〉;  Schriftwerk;   gemütlos;  Stil〉;  ausgetrocknet;   festländisch;  hager 〈Person〉;  mager machend;   nicht durch Wasser betrieben 〈Mühle〉;  prosaisch;   trocken 〈Speise〉;  kalt 〈Kost〉;   trocken 〈Amme〉;  nicht melkbar 〈altes Muttertier〉;   nicht vollgültig 〈Gegenstand〉;  seinen Aufgaben nicht voll nachkommend 〈Person〉;  trocken 〈Person;  fad 〈Vortrag;   trocken 〈Wein〉;   trockener Teil;   Trockenes 〈Kleidung〉;   Trockenfutter	trocken	trocken-3
1082	1786	DRY UP	töpped	  runzelig werden 〈Haut〉; verdorren 〈Obst〉;   trocknen;  verschmachten;   klebenbleiben	  trocknen	trocknen-1
1083	1360	DUCK	kacsa	Ente;   haltloses Gerücht;   Note »ungenügend« 〈in der Schülerspr〉;   Harngefäß für Kranke;   flaches Steinchen auf eine gewisse Art auf die Wasseroberfläche werfen	Ente	Ente-1
1084	1360	DUCK	réce	Ente	Ente	Ente-2
1087	2	DUST	por	Staub;   Schießpulver;   Pulver 〈Arznei;  Reinigungsmittel usw〉;   Staubhülle 〈des Toten〉;   Überlebtheit;  Verstaubtheit;   Streusand;   Staubgefäß 〈Bot〉;   Klopfer 〈Stange;  Städler〉	Staub	Staub-3
1088	363	DWELL (LIVE, RESIDE)	él¹	 Nahrung;  gebrauchen;  gebrauchen;   Amme;   Amme; leben; leben;   sich nähren;   sich nähren;  sich erhalten;  sich erhalten;   benützen;   benützen;   mit jemandem 〈dauernd〉zusammen sein;  mit jemandem zusammen wohnen;   irgendein Leben führen;  irgendwelchem Zustand sein;   in dauerndem Geschlechtsverhältnis leben;  in ehelichem Verhältnis leben;   sich aufhalten;  wohnen;  wohnen;   Lebensmittel;   Lebensmittel;   Lebensmittel;  Lebensmittel;   Lebensmittel;  élet;  használat;  használat;   Lebendige;   Lebendige;   életmód;   Leben;   Leben;   Leben;   Leben;  megélhetés;   Unterhalt;   Unterhalt;  Fortkommen;  Fortkommen;   Getreide;   Getreide;  ház és udvar;  belsőség;   nähren;   nähren;  beleben;  beleben;  valaminek a használatára késztet;   hochleben lassen;   hochleben lassen;   Lebens-;   Lebens-;   bejahrt werden;   bejahrt werden;   bejahrt werden;   bejahrt werden;   lebhaft werden;   lebhaft werden;  erstarken;  erstarken;   genießbar;   genießbar;  brauchbar;  brauchbar;  életrevaló;  életképes;  táplál;   Hefe;   Hefe;   sich fristen;   sich fristen;  valamiből él;   schmarotzen;   schmarotzen;  Zehrung;  Zehrung;  élvezet;   Erlebnis;   Erlebnis;   lebenslang ;   lebenslang;   mit jmdm zusammenleben;  bei jmdm leben;    Leben führen;  sich  befinden;   mit jmdm  leben;   verweilen;  Broterwerb	 wohnen	wohnen-1
1089	363	DWELL (LIVE, RESIDE)	él¹	 Nahrung;  gebrauchen;  gebrauchen;   Amme;   Amme; leben; leben;   sich nähren;   sich nähren;  sich erhalten;  sich erhalten;   benützen;   benützen;   mit jemandem 〈dauernd〉zusammen sein;  mit jemandem zusammen wohnen;   irgendein Leben führen;  irgendwelchem Zustand sein;   in dauerndem Geschlechtsverhältnis leben;  in ehelichem Verhältnis leben;   sich aufhalten;  wohnen;  wohnen;   Lebensmittel;   Lebensmittel;   Lebensmittel;  Lebensmittel;   Lebensmittel;  élet;  használat;  használat;   Lebendige;   Lebendige;   életmód;   Leben;   Leben;   Leben;   Leben;  megélhetés;   Unterhalt;   Unterhalt;  Fortkommen;  Fortkommen;   Getreide;   Getreide;  ház és udvar;  belsőség;   nähren;   nähren;  beleben;  beleben;  valaminek a használatára késztet;   hochleben lassen;   hochleben lassen;   Lebens-;   Lebens-;   bejahrt werden;   bejahrt werden;   bejahrt werden;   bejahrt werden;   lebhaft werden;   lebhaft werden;  erstarken;  erstarken;   genießbar;   genießbar;  brauchbar;  brauchbar;  életrevaló;  életképes;  táplál;   Hefe;   Hefe;   sich fristen;   sich fristen;  valamiből él;   schmarotzen;   schmarotzen;  Zehrung;  Zehrung;  élvezet;   Erlebnis;   Erlebnis;   lebenslang ;   lebenslang;   mit jmdm zusammenleben;  bei jmdm leben;    Leben führen;  sich  befinden;   mit jmdm  leben;   verweilen;  Broterwerb	 wohnen	wohnen-2
1092	157	DYE	fest	  hübsch; färben;  bemalen;  anstreichen;   malen 〈Bild〉;   schminken;  färben 〈Haar〉;   schildern;  darstellen;   abfärben;   aussehen;   färber;   Kunstmaler;   Anstreicher;   die Malerei betreffend	färben	farben-1
1093	1905	EAGLE	sas	 Kerbe;  Haken;   Nagel; Adler;   eingekerbter Balken;   Splint	Adler	Adler-1
1094	1247	EAR	fül	  Alkoven;   Ohrfeige; Ohr;  Ohrmuschel;   Henkel;  Nische;  Versteck;   eingeknickte Ecke einer Seite;  Klappe 〈des Buchumschlages〉;   Langohr 〈Hase〉;   Nachricht	Ohr	Ohr-2
1095	1247	EAR	kagyló	Schnecke;   Ohr;   Muschel;  Muschelschale;   Schnecke 〈Med〉;   Mutter der Spindel der Weinpresse;   Becken 〈Badezimmer;  Spülabort〉;   Hörmuschel	  Ohr	Ohr-3
1096	1228	EARTH (SOIL)	föld	  Lanmann;  Land; Erde;  Boden;   Erdkugel;   Acker;   Tonerde;   Festland;   Grundfarbe eines Webstoffes;   über kultivierbares Land verfügend;   Erde transportieren;   erden	Erde	Erde-1
1097	1228	EARTH (SOIL)	rög	Scholle;   Erde;  Boden; anhaften;   Klumpen;   festsitzen	  Erde	Erde-2
1098	1877	EAST	kelet¹	Osten;  Ost;   Orient;  Morgenland	Osten	Osten-1
1099	1877	EAST	kelet¹	Osten;  Ost;   Orient;  Morgenland	 Ost	Ost-1
1100	1336	EAT	burok	  einwickeln; Hülle;  Kapsel;   Fruchtblase;   dichtes Laub;   zusammenbinden;   essen	  essen	essen-1
1101	1336	EAT	eszik	 Proviant;  Appetit; essen;   Speisesaal;  brennen;   Hunger;   Speise;   aufzehren;   〈an jmdm od etw〉 zehren;  zerfressen;   beißen;   Speisen;   Speisen;   jmdm zu essen geben;  füttern;   vergiften;   vergiften;   eingeben;   Speise enthaltend;  zum Speisen gebräuchlich;   eßlustig;  evés nélkül;  éhgyomorra;   appetitlos;   ungenießbar;  Kantine	essen	essen-2
1105	863	EDGE	él²	Spitze;  Spitze;  Kante;   Bergspitze;  Gebirgsausläufer;   Spitze einer Stichwaffe od eines Werkzeuges;  Schärfe 〈auch abstr〉;   Schlachtlinie;  geordnetes Heer;  erste Stelle;   kantig;   scharf;  spitz	 Kante	Kante-1
1106	863	EDGE	párkány¹	 Kante;   Rand; Schutzmauer;  Schanze;   Gesims	 Kante	Kante-2
1111	744	EGG	tojik	  zur Welt bringen;   Ei;   den Darm entleeren; Eierlegen 〈Vogel〉;   Eier legen 〈Insekt〉;   Legenest;   Legehenne;   Eierlegen	  Ei	Ei-3
1112	1705	EIGHT	nyolc	acht;   achte;   Achtel	acht	acht-1
1113	1722	EIGHTY	nyolcvan	achtzig	achtzig	achtzig-1
1114	981	ELBOW	könyök	Biegung;  Kniestück;  Winkelstück;   Ellbogenteil einer Kleidung;  Panzerung;   Ellbogen;   Ellbogen;   Elle 〈als Lägenmaß〉;   Art Liege;   Art Brüstung;  Armstütze;   eine Elle lang	  Ellbogen	Ellbogen-1
1115	981	ELBOW	könyök	Biegung;  Kniestück;  Winkelstück;   Ellbogenteil einer Kleidung;  Panzerung;   Ellbogen;   Ellbogen;   Elle 〈als Lägenmaß〉;   Art Liege;   Art Brüstung;  Armstütze;   eine Elle lang	  Ellbogen	Ellbogen-2
1118	1772	ELK	jávorszarvas	Elch;  Elentier	Elch	Elch-1
1119	1076	EMERGE (APPEAR)	hat¹	  Wirkung;   haben;    dringen;  vermögen; können;   ergreifen;  packen 〈Gefühl〉;   wirken;  wirksam sein;   erscheinen;  anmuten;   Behausung;   über Macht verfügend;   wirksam;   wirksam;   ungangbar;   Eindringen;   durchdrungen werden;   gerührt sein;   rührend	  erscheinen	erscheinen-1
1120	1076	EMERGE (APPEAR)	jelent	  erklären;   offenbaren;   aussprechen;   darstellen;  beichten;   erscheinen;   bedeuten;   Erscheinung; bekanntmachen;  melden;  feierlich kundtun;   gestehen;   verraten;   prophezeien;   Bedeutung haben;  wichtig sein;  gleichwertig sein mit etw;   Verkündigung;   Berichterstattung;   Bedeutung	  erscheinen	erscheinen-2
1123	1624	EMPTY	hézag	 Zwischenraum;  Eingeweide;   Bauch;   Lücke;  überflüssig; leer;   leer;  hohl;  Fuge;   leer machen;  ungültig werden	leer	leer-1
1124	1624	EMPTY	hézag	 Zwischenraum;  Eingeweide;   Bauch;   Lücke;  überflüssig; leer;   leer;  hohl;  Fuge;   leer machen;  ungültig werden	  leer	leer-2
1134	743	END (OF TIME)	cél	  zielen;   Kampf;  Ende; Wettbewerbsziel;  Zielpunkt;   Symbol;   Grenze;   Bestimmung;  Zweck;   Gegenstand;  worauf sich eine Tätigkeit richtet;   Absicht;   auf etw anspielen	 Ende	Ende-2
1136	743	END (OF TIME)	farok	 Ende;   Penis;   Pinsel; Schwanz;  Schweif;  Vogelschwanz;   hinausragender Teil;  Hinterteil von etw;   die letzten Tage;  Ende einer Zeitspanne;   Gefolge;  Geleit;   geschwänzt	 Ende	Ende-4
1145	833	ENDURE	áll¹	  behaupten;   behaupten ; stehen;  sich in einer Lage befinden;   stillstehen;   emporragen;  sich erheben;   bestehen;  existieren;   gelten 〈Wort usw.〉;   aushalten;  ertragen;   in eine Lage;  in einen Zustand kommen;   abhängen;   sich zusammensetzen;  sich offenbaren;   fortdauern;  erhalten bleiben;   wert sein;  kosten;   stellen;   stellen;   Stelle;  Position;   Dienststelle	 ertragen	ertragen-1
1146	833	ENDURE	bír	  unterwerfen;   ertragen; besitzen;  haben;   beherrschen;   verschaffen;   veranlassen;   zu etw fähig sein;  imstande sein;   Besitzer	  ertragen	ertragen-2
1150	1358	ENEMY	ellen	  Hindernis;   für;  Kampf;   aus;   Streit;   Widersetzlichkeit;   widersprechen;   entgegen; gegenüber;   gegen;   gegen;   gegen;   gegen;  wider;  wider;  wider;  zu 〈als Richtung〉;   gegenüber 〈in abstr Bed〉;   von gegenüber;  von entgegengesetzter Richtung;   abweichend;   gegnerisch;  feindlich;   Feind;   Entgegengesetztes;   Entgegengesetztes;  szemben levő;   Schirm;   Opposition 〈polit〉;   trotz;   trotz	  Feind	Feind-1
1151	749	ENTER	virul	  beginnen;   blühen;  Unternehmen〉; aufsprossen;  Knospen treiben;   aufbrechen;  sich zeigen;   gesund sein;  blühen 〈Person〉;   gedeihen 〈Institution;  eintreten	 eintreten	eintreten-1
1152	1615	ESCAPE	emigráció	Fortzug;  Entfliehen;   Auswanderung 〈bes aus religiösen od polit Gründen〉;   Emigration als Zustand;  Gesamtheit der Emigranten	 Entfliehen	Entfliehen-1
1153	1615	ESCAPE	fut	  strömen;   Laufen;   sich erstrecken;  bedecken;  fließen; laufen;   laufen;  sich schnell vorwärtsbewegen;   fliehen;  flüchten;   durchwandern;   im Gange sein;   meiden;   sich befleißigen;  streben;   bewachsen;  klettern 〈Pflanze〉;   etw durchdringen;  überlaufen;   rindern;   etw flüchtig durchlesen;   sich schnell verbreiten 〈Nachricht;  Feuer usw〉;   jmdn;  etw befolgen;  jmdm nachlaufen;   es reicht aus;   zur Geltung kommen;  in Kraft sein;  auf dem Programm sein;   Wettläufer;   Läufer 〈im Schachspiel〉;   umherlaufen;  futva;  futásuk közben;  összesereglését;   laufen lassen;   anlaufen lassen;  vergolden;  versilbern	 flüchten	fluchten-1
1161	1629	EVENING	est	Abend;   Nachtviole	Abend	Abend-1
1162	1629	EVENING	vecsernye	  Abend; Vesper;  Vesperzeit	  Abend	Abend-2
1164	2999	EVERYWHERE	szanaszét	 durcheinander;   überall; auseinander	  überall	uberall-2
1166	45	EVIL	bal	  falsch;   böse; linke;   die linke Seite;   die linke Hand;   Linkshänder	  böse	bose-2
1167	45	EVIL	élhetetlen	 unbeholfen;   ungeschickt;  böse;  nichtswürdig; nicht lebensfähig;  verkrüppelt;  erbärmlich;   unbrauchbar;   〈moralisch〉 schlecht	 böse	bose-3
1175	1426	EXPENSIVE	drága	  wertvoll; sehr lieb;  geliebt;  teuer;  kostspielig;    Teuerung;   sehr liebe;  geliebte Person;  schätzen;   zu teuer finden	 teuer	teuer-1
1176	1426	EXPENSIVE	gazdag	reich;   reichlich;   wertvoll;  teuer;  reichhaltig;   Reiche;   reich werden;   sehr reich;   sehr reich	 teuer	teuer-2
1177	1248	EYE	szem	  Ansicht;   unverschämt;   Beere;   Glied;  frech;  Rücksicht;   besehen;   Korn;   Blick;   Punkt;   Masche;   auslesen; Auge;  Beurteilung;   ein Körnchen 〈als Maß〉;   augenförmige Verzierung;  Werteinheit 〈auf Spielkarten;  Würfeln usw〉;   Körner hervorbringen;   Körner hervorbringen;   augenlos;  besichtigen;  sortieren;   großäugig;   mit jmdm äugeln;  kokettieren;   Auswahl	Auge	Auge-1
1178	1560	FACE	kép¹	  Bild;   Bild;  Gestalt;  Vertreter; Form;   Schein;   Sinnbild;   Ähnlichkeit;  Vorstellung;   Erscheinung;   Redebild;  Bildnis;   Gesicht;  Miene;   Standbild;  Biläule;  Ebenbild;   Vertretung;   Genrebild;  Auftritt 〈im Theater〉	  Gesicht	Gesicht-1
1179	1560	FACE	orca	  Kinn; Gesicht;  Gesicht;   Äußeres;   Wange;   Antlitz	Gesicht	Gesicht-2
1184	2937	FAIRY TALE	beszéd	Rede; Rede;   Wort;   Wort;   Märchen;   Märchen	  Märchen	Marchen-1
1185	2937	FAIRY TALE	beszéd	Rede; Rede;   Wort;   Wort;   Märchen;   Märchen	  Märchen	Marchen-2
1187	1280	FALL	borul	stürzen;  fallen;   sich verdunkeln;  sich verdüstern;   sich häupteln	 fallen	fallen-1
1188	1280	FALL	bukik	 stürzen;   fallen; tauchen;   eine Niederlage erleiden;   auf etw stoßen;   die führende Rolle verlieren;   fallieren;   zu Fall kommen;   durchfallen 〈in einem Unterrichtsfach〉;   der Polizei in die Hände fallen;   erpicht sein	  fallen	fallen-2
1196	1106	FALL ASLEEP	álom	Traum;   Schlaf;   Einschlafen 	  Einschlafen 	Einschlafen-1
1197	3005	FAMILIAR	notórius	 berüchtigt; eines schweren Verbrechens schuldig;   bekannt;   unverbesserlich	  bekannt	bekannt-1
1198	194	FAMILY	család	zwangsgesiedelter fremder Gefangener;   Mitglied des Gesindes;  Diener;   Familie;   Familie 〈Zool;  Bot〉;   Kind als Mitglied einer Familie;   Hereinnahme von As;  König und Ober der Trumpffarbe 〈im Klabrias〉	  Familie	Familie-1
1199	194	FAMILY	cseléd	  Knecht;   Mensch; Familie;   Kind als Mitglied einer Familie;   Mitglied der Familie od des Hausgesindes;  Dienstmagd;   Traintruppe;  Troß;   Dienerschaft;   Frauenzimmer	Familie	Familie-2
1205	1406	FAR	messze	  weit;   lange; weit 〈von einem Zeitpunkt〉;   weithin;  fern 〈räumlich〉;   bei weitem;   entfernt 〈räumlich〉;   ausgedehnt;   fern;  entfernt 〈von einem Zeitpunkt〉;   Ferne	  fern	fern-1
1206	1406	FAR	távol	 fremd;   weit;   fern;   Ferne;  Weite; entfernt;  weit 〈auch abstr〉;   von fern;   fernhin;   vor bzw nach langer Zeit	  fern	fern-2
1209	1279	FAT (OBESE)	boldog	  schwanger; heilig;  selig;   selig;   reich;   glücklich;  freudig;  zufrieden;   friedlich;  gut;   dick;   fortkommen;   fortkommen;   glücklich werden;   Verstorbener;   verstorben	  dick	dick-1
1210	1279	FAT (OBESE)	busás	  grob;  dick;   reichlich;   eigensinnig;   untersetzt; breitstirnig;  mit krausem Stirnhaar;  rücksichtslos;  ausgiebig;  störrisch;   dicht 〈Augenbrauen〉	 dick	dick-2
1226	323	FAT (ORGANIC SUBSTANCE)	kövér	dick;   groß;  fett;   fett;  feist;   dickblättrig;  sukkulent;   fruchtbar;  fett 〈Boden〉;  nahrhaft 〈Speise〉;  reichlich 〈Mahlzeit〉;   einträglich;  sich lohnend;  voll 〈Gegenstand〉;   fett 〈Druckschrift〉;   fettes Opfertier;  reichliches Opfergeschenk;   Fett;  Schmalz;   fett machen;   als dick sehen lassen	  Fett	Fett-1
1227	323	FAT (ORGANIC SUBSTANCE)	pecsenye	 Speck;   Fett; Braten;   versch Schlachtteile vom Rind;  Wild und Schwein als rohes Fleisch	  Fett	Fett-2
1231	1217	FATHER	apa	Vater;   bejahrter Mann;   bejahrter Mann;   Zunftmeister;   Schwiegervater;   geistiger Urheber;   allverehrter Mann;   Ahn;  Väterchen;   Väterchen;   Väterchen;   Väterchen	Vater	Vater-1
1232	1217	FATHER	após	  Vater; bejahrter Mann;   Schwiegervater;  Väterchen;   Großvater	  Vater	Vater-2
1238	134	FAULT	teher	  belästigen;   schwanger;  Krug; Last;   schwer;   Ladung;   Knechtschaft;   Eimer;   Pflicht;  Bürde;   beladen;   beladen;   Schwangerschaft;   Schwangerschaft;  Schuld;   beladen werden;    belastet sein	 Schuld	Schuld-1
1239	1419	FEAR (BE AFRAID)	dübög	  dröhnen; pochen 〈Herz〉;   sich fürchten;  sich ängstigen	  sich fürchten	sichfurchten-1
1240	1419	FEAR (BE AFRAID)	dübörög	 dröhnen;   sich fürchten	  sich fürchten	sichfurchten-2
1246	1201	FEATHER	iscsap²	 Spund;   Kneipe; hahn;   〈als Benennung zapfenförmiger Dinge〉;   Feder;   Stuhlzäpfchen;   〈eisernes〉 Grindelende;   Zapfen;   Fruchtzweig;   Spieß 〈eines Hirsches〉;   Schenker	  Feder	Feder-1
1247	1201	FEATHER	zászló	  Rispe;  Feder; Fahne;   Offiziersanwärter;  Flagge;  Ähre des Maises;  Standarte;   Bataillon;   Absteck-;  Wetterfahne usw;   schwebende;  flatternde Behaarung	 Feder	Feder-2
1249	2037	FEBRUARY	február	Februar	Februar	Februar-1
1250	739	FEED	eszik	 Proviant;  Appetit; essen;   Speisesaal;  brennen;   Hunger;   Speise;   aufzehren;   〈an jmdm od etw〉 zehren;  zerfressen;   beißen;   Speisen;   Speisen;   jmdm zu essen geben;  füttern;   vergiften;   vergiften;   eingeben;   Speise enthaltend;  zum Speisen gebräuchlich;   eßlustig;  evés nélkül;  éhgyomorra;   appetitlos;   ungenießbar;  Kantine	 füttern	futtern-1
1251	739	FEED	legel	  nähren;   sich ergötzen;  füttern;  grasen; weiden;  sich weiden	 füttern	futtern-2
1253	2559	FEEL (TACTUALLY)	érez	fühlen;  empfinden;   sinnlich wahrnehmen;  bemerken;   verstehen;   ahnen;   aufschrecken;  zur Besinnung kommen;   Empfindungsfähigkeit;   Empfindungsfähigkeit;   Empfindungsfähigkeit;   Gefühl;   Gefühl;   Gefühl;   Sinnesempfindung;   Sinnesempfindung;   gefühllos;   Empfindlichkeit;   Sinn;  Verständnis;   empfindbar;  fühlbar;   empfindlich;   sich fühlen lassen;  érzékelhetőség	fühlen	fuhlen-1
