ID	CONCEPTICON_ID	CONCEPTICON_GLOSS	FORM	MEANING	SENSE	SENSE_ID
2719	2968	REASON	alap	Grund;  Fundament 	Grund	Grund-2
2727	2870	RECOGNIZE (SOMEBODY)	ellát	  erledigen;   verwalten; besehen;   versorgen;  ausstatten;   einsehen;  erkennen;   voraussehen;   bis nach etw sehen;   es jmdm  geben	 erkennen	erkennen-1
2728	2870	RECOGNIZE (SOMEBODY)	ért	  meinen;  untersuchen;   Abhandlung;   erkennen; verstehen;   sich auf etw verstehen;   sich einigen;  mit jmdm eine Vereinbarung schließen;   deutlich hören;   jm Meinung;  Handlungen;  Seelenzustand für begründet halten;  Mitgefühl haben;   Kenner;   verständlich machen;   erörtern;   einsichtsvoll;   Erkundigung;   Vernünftigkeit;   Intelligenz;   Zeitschrift;   Zeugnis	  erkennen	erkennen-2
2730	1978	RECOVER	gyógyul	eine Krise allmählich überwinden;  von einer Gemütskrankheit genesen;   genesen;  zuheilen 〈Wunde〉	  genesen	genesen-1
2731	1978	RECOVER	ocsúdik	 zur Besinnung kommen;   genesen; erwachen	  genesen	genesen-2
2732	156	RED	bíbor	 Samt; feines Leinengewebe;   rotfarbiger Kleiderstoff;   Purpurfarbe;  Rot;   aus dem Saft der Purpurschnecke gewonnener Farbstoff;   Inkarnatklee;   purpurfarben 〈Kleid〉;  rot gefärbt 〈Kleid〉;   aus Leinengewebe gemacht 〈Kleid〉;   Kardinal	 Rot	Rot-1
2733	156	RED	piros	  Rot;  Person〉;   lustig;  Körper; rot;  rötlich 〈Wange;   rot geröstet;  gebraten;  gebacken 〈Speise〉;  flott;   Rot der Spielkarte;   Verkehrsampel;   rote Schminke	  Rot	Rot-2
2741	707	REMEMBER	emlékezik	sich erinnern; sich erinnern;   erwähnen;   erwähnen	sich erinnern	sicherinnern-1
2742	707	REMEMBER	emlékezik	sich erinnern; sich erinnern;   erwähnen;   erwähnen	sich erinnern	sicherinnern-2
2746	2008	RESCUE	ment¹	 entschuldigen;   Entschuldigung; retten;  befreien;  hüten;  wahren;   entfliehen;   verteidigen;   freisprechen;  entlasten;   Befreier 〈auch Sache〉;   Rettungsdienst	retten	retten-2
2747	168	REST	lézeng	herumschweifen;  sich herumtreiben;  wanken;   ausfliegen;   schwindeln;  sich erholen	 sich erholen	sicherholen-1
2748	168	REST	nyugszik	 schlafen;   ruhig;   beruhigen;   unruhig;  liegen;   sterben;   sich beruhigen; ruhen;   Ruhe halten;  ruhig bleiben;   untergehen 〈Himmelskörper〉;   ruhen 〈Leiche〉;   sich fügen;  sich zufrieden geben;   beruhen;  sich gründen	ruhen	ruhen-1
2750	1723	RESULT IN	esik	  ungeschickt;   Fall;   〈in einen Zustand〉 kommen;  flehen;  Maß〉;  stürzen; fallen;  fallen;   es regnet;  liegen;   fallen lassen;   Sonnenuntergang;   befallen;  bedecken;  geraten;   geschehen;   auf die Knie fallen;   den Tod finden;  es schneit;  es hagelt usw;   jmdm zuteil werden;   〈einem irgendwie〉 schmecken;  behagen;   sein;   hineindrängen;   sich auf jmdn stürzen;   sich erbarmen;   abnehmen 〈Menge;   Kasus;   ohne Fall;   vergänglich	 geraten	geraten-1
2751	1723	RESULT IN	fakad	 Ausschlag;  entstehen;   geraten; sprossen;   in etw ausbrechen;   entspringen;  hervorquellen 〈auch abstr〉;   zu etw werden;   zerspringen;  zerplatzen;   Pustel;   Geschwür	  geraten	geraten-2
2754	2969	RIBBON	gyeplő	Strick;   Zügel;  Seil;  Band	 Band	Band-1
2755	2969	RIBBON	kantár²	Zaum;   Band;  Schleife 〈eines Kleidungsstückes〉;   Tragnetz;  meist aus Riemen od Bindfaden	  Band	Band-2
2763	712	RICH	boldog	  schwanger; heilig;  selig;   selig;   reich;   glücklich;  freudig;  zufrieden;   friedlich;  gut;   dick;   fortkommen;   fortkommen;   glücklich werden;   Verstorbener;   verstorben	  reich	reich-1
2764	712	RICH	bő	reich;   breit;  weit;   weitschweifig;  ausführlich;   sich vermehren;   reichlich	reich	reich-2
2773	1374	RING	abroncs	reif;   Kreis;  Ring;   Reifen am Saume des Frauenkleides	 Ring	Ring-1
2774	1374	RING	gyűrű²	Ring;  Reif;   Locke;  reifförmiger Gegenstand;   Fingerring;  Trauring;   Ringe 〈Turngerät〉;   Verlobte;   Unterpflügen	Ring	Ring-2
2778	2875	RING (MAKE SOUND)	csilingel	hell läuten;  klingeln	 klingeln	klingeln-1
2779	2904	RINSE	öblít	spülen;  schwemmen	spülen	spulen-1
2780	178	RIPE	abroncs	reif;   Kreis;  Ring;   Reifen am Saume des Frauenkleides	reif	reif-1
2781	178	RIPE	dér	  Frost; Reif;  klares Wetter im Winter;   mit ergrautem Haar;  Bart;   bereift;   eisgrau 〈Pferd〉;   Grauschimme	Reif	Reif-1
2785	179	RIPEN	karika	Kreis;  Ring;   Faß;  Reifen;   Scheibe;  kreisrunde Form;   kreisförmiger Gegenstand;  Scheiben- od walzenförmiger Gegenstand;   Laufreifen als Spielzeug;   kreisförmige Scheibe;   geringelt;   Art Peitsche	 Reifen	Reifen-2
2787	568	RISE (MOVE UPWARDS)	száll	 aus-;   sinken;   ein-;   befallen;   fliegen;  sich legen;  besetzen;  rücken;   schwinden;  sich widersetzen;   jmdm zufallen;   Westen;   Belagerung; sich setzen;  sich herunterlassen;   sich begeben;  ziehen 〈Heer〉;  aufsteigen;  absteigen;   einkehren;  einziehen;   belagern;  fallen 〈Wasserhöhe〉;  sich ablagern 〈Satz〉;   den Kampf aufnehmen;  leszállása közben;   Logiergast;   Angehöriger einer Besatzungsarmee;   Überkommen;  Besetzung;   Sichniederlassen;  apránként aláereszkedik	 aufsteigen	aufsteigen-1
2789	667	ROAD	út	 Verfahren;   Gang; Weg;   Möglichkeit;   Fahrt;   Laufbahn;  Ablauf;   Art und Weise;   Fahrgast;  Reisender;  Straße;  um etw zu erledigen;  Reise;   Anlaß	 Straße	Strae-1
2790	667	ROAD	utca	  Marktplatz; Gasse;  straße	 straße	strae-1
2791	2876	ROAR (OF SEA)	bőg	 schreien; brüllen;  lärmen 〈Person〉;   muhen;   röhren;   brausen;  heulen 〈Gegenstand;  Naturerscheinung〉;   brüllend weinen;   Baßgeige	  brausen	brausen-1
2792	2876	ROAR (OF SEA)	búg¹	  brausen;  brummen; 〈die Köpfe zusammensteckend〉 flüstern;   girren;  gurren;   brünstig sein;  sich begatten 〈haupts Schwein〉	  brausen	brausen-2
2805	769	ROOF	fedél	  Decke;   Schutz;   Deckel;   Deck;   Deck; Dach;   dachen;   Dachung	Dach	Dach-1
2806	769	ROOF	födém	Dach;   Geschoßdecke	Dach	Dach-2
2809	1511	ROOSTER	iscsap²	 Spund;   Kneipe; hahn;   〈als Benennung zapfenförmiger Dinge〉;   Feder;   Stuhlzäpfchen;   〈eisernes〉 Grindelende;   Zapfen;   Fruchtzweig;   Spieß 〈eines Hirsches〉;   Schenker	hahn	hahn-1
2810	1511	ROOSTER	kakas	  Penis eines kleinen Knaben;   Franzose; Hahn;   Männchen verschiedenartiger Vögel;   Wetterhahn;   Flintenhahn;   Mann 〈von der Sexualität her gesehen〉;   Feuerbrand;   durch Rösten geborstene Maiskörner;   roter Fleck;  Tippel von einem Hieb od Schlag;   der ganze Nußkern;   raufsüchtiger Knabe	Hahn	Hahn-1
2811	670	ROOT	csíra	 Anfang; Keim;   Wurzel	  Wurzel	Wurzel-1
2812	670	ROOT	tő	 Einfluß;  Stock;   Wurzel;  Wurzel;  Stamm;   Bestandteil; Flußmündung;   nächste Umgebung 〈eines Ortes〉;   Weinstock;   Ansatz;   Haarwurzel;   Wortstamm;   gestampftes Erdbänkchen vor dem Haus;   Hackblock	  Wurzel	Wurzel-2
2814	2907	ROT	korhad	morsch werden;  verfaulen	 verfaulen	verfaulen-1
2816	2907	ROT	poshad	  faul;  faulenzen;  sauer werden; verfaulen;   abstehen;  verroten;  ausgären;  träge werden 〈Person〉;  schal werden 〈Flüssigkeit〉;  stinkig werden	verfaulen	verfaulen-3
2818	1395	ROUND	gombolyag	  Kokon; Knäuel;   Kugel;  Ballen;   rund;  kugelrund	  rund	rund-1
2819	1395	ROUND	gömbölyű	Kugel;  rund;   rund;   kugel-;  walzenförmig;   rundlich;  dicklich;  unumwunden 〈Antwort〉	 rund	rund-2
2825	1849	ROW	evez	  nach etw streben;   herumfuchteln; rudern;  schiffen;   mit den Flügeln schlagen;  fliegen;  die Schwimmflossen bewegen;  schwimmen;   mit dem Schwanz wedeln;   sich 〈in irgendeinem Zustand〉 befinden;  sich 〈auf irgendeinem Gebiet〉 betätigen;  sich mit den Armen rudernd vorwärtsbewegen;   schaukeln;   Ruderer;   Rudern	rudern	rudern-1
2826	1849	ROW	evez	  nach etw streben;   herumfuchteln; rudern;  schiffen;   mit den Flügeln schlagen;  fliegen;  die Schwimmflossen bewegen;  schwimmen;   mit dem Schwanz wedeln;   sich 〈in irgendeinem Zustand〉 befinden;  sich 〈auf irgendeinem Gebiet〉 betätigen;  sich mit den Armen rudernd vorwärtsbewegen;   schaukeln;   Ruderer;   Rudern	  Rudern	Rudern-1
2827	1449	RUB	csiszol	schleifen;  reiben;   polieren	 reiben	reiben-1
2828	1449	RUB	dörzsöl	reiben	reiben	reiben-2
2842	1846	RULE	bír	  unterwerfen;   ertragen; besitzen;  haben;   beherrschen;   verschaffen;   veranlassen;   zu etw fähig sein;  imstande sein;   Besitzer	  beherrschen	beherrschen-1
2843	1846	RULE	dominál	beherrschen;   führende Rolle spielen	beherrschen	beherrschen-2
2851	1519	RUN	baktat	langsam gehen;   buchstabierend lesen;   Laufen;   humpeln;  hinken;   nickend schlummern	  Laufen	Laufen-1
2852	1519	RUN	fut	  strömen;   Laufen;   sich erstrecken;  bedecken;  fließen; laufen;   laufen;  sich schnell vorwärtsbewegen;   fliehen;  flüchten;   durchwandern;   im Gange sein;   meiden;   sich befleißigen;  streben;   bewachsen;  klettern 〈Pflanze〉;   etw durchdringen;  überlaufen;   rindern;   etw flüchtig durchlesen;   sich schnell verbreiten 〈Nachricht;  Feuer usw〉;   jmdn;  etw befolgen;  jmdm nachlaufen;   es reicht aus;   zur Geltung kommen;  in Kraft sein;  auf dem Programm sein;   Wettläufer;   Läufer 〈im Schachspiel〉;   umherlaufen;  futva;  futásuk közben;  összesereglését;   laufen lassen;   anlaufen lassen;  vergolden;  versilbern	  Laufen	Laufen-2
2870	2877	RUSTLE (OF LEAVES)	suhog	 brausen;  summen;  sausen;   flink;   zischen;   flüstern;  kochen; schwirren;   rauschen;  rührig vonstatten gehen 〈Arbeit〉	  rauschen	rauschen-1
2871	2990	SACK	szatyor	Korb;   Hühnerkorb;   Beutel;  Sack;  Einkaufstasche;   alte Schachtel 〈alte Frau〉;  alter Kracher;  Legekasten für Hühner	 Sack	Sack-1
2873	2990	SACK	zsák	 Ranzen;   Zisterne;   Beutel;   beladen;   Sack; grobes Tuch;   Kleidungsstück aus grobem Tuch;  Büßergewand;  Säcklein;   Ausbuchtung des Fischernetzes;   Mager;   〈in einen Sack〉 einpacken	  Sack	Sack-3
2874	699	SAD	keserves	  wertlos;  geringwertig;   kläglich;   bitter; traurig;  erbittert 〈Person〉;   schmerzlich;  sauer;  bitterlich;   sauer erworben;   〈als Schimpfw in mildem Fluch〉;   Klageweib;   trauriges Musikstück	traurig	traurig-1
2875	699	SAD	szomorú	traurig;   traurig;  schmerzlich;  trüb;  trüb;  betrübt;   betrüblich;   bewölkt;   Traurigkeit	traurig	traurig-2
2879	1274	SALT	só	  salzlos;  Witz;  Geist;   Würze; Salz;   natronreicher Ort;  natronhaltige Wüste	Salz	Salz-1
2880	671	SAND	föveny	  Kampfplatz;   Stein; Sand;  Sandgrund	Sand	Sand-1
2881	671	SAND	homok	Sand	Sand	Sand-2
2884	1458	SAY	kérődzik	sagen;  aussagen;   rülpsen;  wiederkäuen;   über etw grübeln;  etw wiederkäuen	sagen	sagen-1
2885	1458	SAY	mond	 behaupten;  Ausdruck;  nennen; sagen;  Ausdrucksweise;  sprechen;   Thema;  Stoff 〈einer Erzählung;  eines Vortrags〉;   Spruch;   Spruch;   Spruch;   Sagen	sagen	sagen-2
2890	1767	SCRAPE	csikar	  kratzen; zwicken;  kneifen;  ritzen;   knarren lassen;  mit den Zähnen knirschen;   abdringen;  erpressen	  kratzen	kratzen-2
2892	1767	SCRAPE	kapar	 Gewürz;   kratzen;   kritzeln;   scharren; erhaschen;   begraben;  verscharren;    kratzen 〈Rauch;  Staub〉;   auskratzen 〈Kürettage〉	  kratzen	kratzen-4
2900	1474	SEA	tenger	  Unmenge;   ungeheuer;  unzählig;  See; Meer;   Meer-	Meer	Meer-1
2901	1474	SEA	tenger	  Unmenge;   ungeheuer;  unzählig;  See; Meer;   Meer-	  Meer-	Meer-2
2902	1384	SECOND	másod	 anderer;  Ebenbild;  folgender; zweiter;   Nachgeburt;   Doppelgänger;   Aftergetreide;   Sekunde 〈Musik〉	zweiter	zweiter-1
2903	1409	SEE	lát	  erfahren;  aufnehmen;   empfangen;  offen;  mit jmdm umgehen;   untersuchen;  prüfen;   erleben;  verstehen;   besuchen;  schauen;  achten;   für etw halten;  zugreifen; sehen;   nach etw sehen;  sich nach etw umsehen;  zur Kenntnis nehmen;   achtgeben;   sich an etw machen;   jmdm etw zuteil werden lassen;   Prophet;   Vision;   Sehen;   sichtbar	sehen	sehen-1
2904	1409	SEE	tekint	 schön;  nehmen;   beachten;   sehen;  ansehen;  berücksichtigen;   sich beziehen; blicken;   jmdn fürsorglich betreuen;  sich um jmdn kümmern;   vertrauensvoll anblikken;  von jmdm Hilfe erwarten;  sehen können;   einen Abstecher machen;   für etw betrachten;   ansehnlich;   Ansehen genießend;  achtbar;   〈bei Anrede;  etwa ehrenwert〉	  sehen	sehen-2
2907	714	SEED	tarló	  Borste;   Saat;   Grummet; Ackerfeld;  Stroh;   Ähre;   Stoppel;  Stoppelfeld;  Getreidefeld;   Strohhalm;   abstoppeln;   auslesen 〈abstr〉	  Saat	Saat-2
2908	714	SEED	mag	  Anfang;   Kern;  Kern;   unfruchtbar;  Geschlecht; Nachkomme;   Sperma;   das Wesentliche;  Samen;   Stammtier;   zur Vermehrung gezüchtet;  kinderlos;   kernig;   gehaltvoll	 Samen	Samen-1
2910	855	SEIZE	fog¹	  aufnehmen;   empfangen;   Griff;   Kniff;  verstehen;   wahrnehmen;   abfärben; greifen;  fassen;  festhalten;   〈Hilfsverb der Zukunft bzw der wahrsch Handlung〉;   fangen 〈Tier〉;  gefangennehmen;   gefangennehmen;   schwanger werden;   ertappen;  in Bedrängnis bringen;   bestimmungsmäßig wirksam sein;   einspannen;   befallen 〈von einer Krankheit〉;  überwältigen 〈von einem Gefühl〉;   nehmen;   nehmen;  mit Beschlag belegen;  dingen;   jmdn zu etw anhalten;  zwingen;  jmdn an etw gewöhnen;   beginnen;   jmdn etw unterstellen;   auf jmdn etw anlegen;   sich auf den Weg machen;   sich auf jmdn beziehen;   bebauen;  bestellen;   auffangen;   kurz entschlossen etw tun;   Zange;  Handhabe;   befingern;   Gefangennehmung;  Griff 〈abstr〉;   Gericht 〈Speise〉;   schwierig;   unbegreiflich;   kleine Zange;   Haschen;   These im Syllogismus;   Gespann;   Geländer	greifen	greifen-1
2911	855	SEIZE	fog¹	  aufnehmen;   empfangen;   Griff;   Kniff;  verstehen;   wahrnehmen;   abfärben; greifen;  fassen;  festhalten;   〈Hilfsverb der Zukunft bzw der wahrsch Handlung〉;   fangen 〈Tier〉;  gefangennehmen;   gefangennehmen;   schwanger werden;   ertappen;  in Bedrängnis bringen;   bestimmungsmäßig wirksam sein;   einspannen;   befallen 〈von einer Krankheit〉;  überwältigen 〈von einem Gefühl〉;   nehmen;   nehmen;  mit Beschlag belegen;  dingen;   jmdn zu etw anhalten;  zwingen;  jmdn an etw gewöhnen;   beginnen;   jmdn etw unterstellen;   auf jmdn etw anlegen;   sich auf den Weg machen;   sich auf jmdn beziehen;   bebauen;  bestellen;   auffangen;   kurz entschlossen etw tun;   Zange;  Handhabe;   befingern;   Gefangennehmung;  Griff 〈abstr〉;   Gericht 〈Speise〉;   schwierig;   unbegreiflich;   kleine Zange;   Haschen;   These im Syllogismus;   Gespann;   Geländer	 fassen	fassen-1
2917	1571	SELL	ad	zukommen lassen;  schenken;   geben;  liefern;   lassen;   verkaufen;   veröffentlichen;   Geben;   Beleg;  Angabe;   Gesetzgeber;   Herausgeber;   〈als Teil eines Schimpfw〉;   Tradition;   Beitrag 	  verkaufen	verkaufen-1
2918	1571	SELL	áru	  verkaufen; Ware;   Verhandeln;   Verrat;  elárusít;   Verkäufer;   Verkäufer;   Verkäufer;  Verräter;  Verräter;  Verräter 	  verkaufen	verkaufen-2
2922	1127	SEND	ereszt	 erweichen; herablassen;  senken;  sich abwärts zu bewegen veranlassen;   schicken;  entlassen;   gestatten;   wachsen lassen;  sprießen;   schwärmen 〈Biene〉;  laichen 〈Fisch〉;  ausbrüten 〈Henne〉;   ausweiten;  lokkern;  verdünnen;   reichlich geben;  tragen 〈Getreide usw〉	  schicken	schicken-1
2923	1127	SEND	igaz	  beweisen;   wahr;  wahrlich;   Wahrheit;   Wahrheit;   ein Urteil fällen;  echt;   echt;   Direktor;   gerecht;   Gerechtigkeit;   heben;   verbessern;   schicken;  Recht;   wahrhaftig; rechtschaffen 〈Mensch〉;  rechtlich;  berechtigt;  Wirklichkeit;   Gerechte;  Rechtschaffene;   richtige;  gerechte Tat;  Billigkeit;   gerechter Anspruch;   Lenker;   für richtig halten;   eigentlich	  schicken	schicken-2
2926	1359	SEPARATE	fejt	  erörtern; trennen;  enthülsen;   deuten;  lösen;   überwältigen;   für ungültig erklären;  aufheben;   abbauen 〈Bergbau〉;   zustande bringen;   abziehen 〈den Wein vom Bodensatz〉;   unlösbar	trennen	trennen-1
2927	1359	SEPARATE	oszt	  geschlechtlich verkehren;  trennen;  Strafe〉;   sich streiten; einteilen;   scheiden;   zerteilen;   etw mit jmdm teilen;   teilen 〈Ansicht〉;  miterleben;  mitfühlen;   es jmdm tüchtig geben 〈Rüge;    mit jmdm teilen	 trennen	trennen-2
2933	2852	SEPTEMBER	szeptember	September	September	September-1
2935	1704	SEVEN	ejt	  verursachen; zu Fall bringen;  im Kampf fällen;   in einen Zustand versetzen;   fallenlassen;   aussprechen;   sieben;   bei jmdm od an etw vorbeikommen	  sieben	sieben-1
2936	1704	SEVEN	gyakorol	  sieben; regelmäßig ausüben;   besuchen;   üben;   hervorrufen;   regelmäßig;   Übung	  sieben	sieben-2
2940	1721	SEVENTY	hetven	siebzig	siebzig	siebzig-1
2942	419	SEVERE	betyár	  schlimm; vazierender;  sich von Tagelohn ernährender junger Mensch;   Straßenräuber;   Schweinehirt;   schmucker Bursch;   Taugenichts;  Spitzbube;   Herrschaftsknecht;  Instmann;   Treidler;   angenommenes Kind;   unbändig;  grob;  ungezogen;  grimmig;   sehr	  schlimm	schlimm-2
2943	419	SEVERE	gonosz	 schlimm;   krank;   Skandal;  Sünde;   böser Geist;  Teufel;  böser Mensch;   Übel; sittlich schlecht;   unheilvoll;  Schaden;   Schandtat;   sittlich schlechter;   Anstoß erregen;   Anstoß nehmen an etw;   moralisch verderben 〈intr〉	 schlimm	schlimm-3
2948	1457	SEW	varr	  flicken;   sticken;  zusammenstellen; nähen;  ausnähen;   einfügen;   Netze knüpfen;   Art ungarische Stickerei;   Naht	nähen	nahen-1
2949	1388	SHADE	árnyék	 Schuppen; Schatten;   Laubhütte;   Abbild;   schattige Noreite;   Spargel;   Schutz;   Abort;   beschattet werden 	Schatten	Schatten-1
2950	1388	SHADE	hiedelem	  Schatten;   Schutz;   Vertrauen;   Meinung;  sich lindern; Erfrischung: Linderung;   Kühle;  Hoffnung;   Glaube;  Glaubensvorstellung;   sich erfrischen	  Schatten	Schatten-2
2951	1909	SHAKE	ráz	 antreiben;   heikel;  holperig;   begeistern; schütteln;  durch Schütteln entfernen;   zerzausen;  zertrümmern;   Zuckungen od Fieberfrost verursachen;   abschütteln 〈abstr〉;   seelisch erschüttern;   Butter machen;   rütteln 〈elektrischer Strom〉;   sehr schüttelnd	schütteln	schutteln-1
2952	1396	SHARP	él²	Spitze;  Spitze;  Kante;   Bergspitze;  Gebirgsausläufer;   Spitze einer Stichwaffe od eines Werkzeuges;  Schärfe 〈auch abstr〉;   Schlachtlinie;  geordnetes Heer;  erste Stelle;   kantig;   scharf;  spitz	  scharf	scharf-1
2953	1396	SHARP	mord	düster;   scharf;  bitter;  unbarmherzig;  bärbeißig;   trüb 〈Wetter〉	  scharf	scharf-2
2956	251	SHARPEN (SOMETHING)	csiszol	schleifen;  reiben;   polieren	schleifen	schleifen-1
2957	1331	SHEEP	juh	Schaf	Schaf	Schaf-2
2958	745	SHELF	polc	  Unterlage;   stützen;  Fach;   Rang;   Sitzbank; Stellbrett für Bücher. Geschirr usw;  Regal;  Stellung;  aufpolstern;   Lehmsitz vor dem Haus bzw am Ofen;   Wandbrett aus Lehm;   Wandbrett;   Lehmsitz vor dem Haus	 Regal	Regal-1
2961	1622	SHIRT	ing	Hemd	Hemd	Hemd-1
2963	52	SHIVER	döcög	 kichern; zittern;   holpern;  watscheln;   lachen	zittern	zittern-1
2964	52	SHIVER	rebeg²	taumeln;   flattern;   zittern;   sich fürchten;  sich  erschrecken;  wehen;  beben;   schwingen 〈intrans〉;   zucken 〈Augenlid〉;   flimmern 〈Stern〉	  zittern	zittern-2
2972	1381	SHOE	cipő	Schuh	Schuh	Schuh-2
2973	1381	SHOE	csuka	  Schuh; Hecht	  Schuh	Schuh-3
2976	1172	SHOOT	lő	 schleudern;   werfen;  werfen; schießen;  schießen;   auslassen;   erledigt od kaputt sein;  es ist Essig damit;   schießen 〈im -ballspiel〉;   Schütze	schießen	schieen-1
2977	1172	SHOOT	lő	 schleudern;   werfen;  werfen; schießen;  schießen;   auslassen;   erledigt od kaputt sein;  es ist Essig damit;   schießen 〈im -ballspiel〉;   Schütze	 schießen	schieen-2
2979	746	SHOP	bolt²	  Bogen; Gewölbe;   Laden;  Geschäft;   Räumlichkeit mit gewölbter Decke;  Kammer;  Keller;  Regenbogen;   gewölbt;   Kaufmann	  Laden	Laden-1
2980	746	SHOP	patika	 Laden;   Kornspeicher; Lagerhaus;   Kräuterladen;  Apotheke;   Heilmethode;   Apotheker	 Laden	Laden-2
2981	3464	SHORE OF LAKE	berek	Ufer; Ufer;   Hain;   Hain;   Moor;   Moor	Ufer	Ufer-1
2982	3464	SHORE OF LAKE	berek	Ufer; Ufer;   Hain;   Hain;   Moor;   Moor	Ufer	Ufer-2
2989	1645	SHORT	által	  absolut; über;  durch;   durch;   gerade;  kurz;   von;  vermittelst;   allgemein;   das absolute Ding 	 kurz	kurz-1
2990	1645	SHORT	csuta	  kurz;   Maiskolben; Wisch;  Strohbündel;  Maisstroh;   Kernhaus;  Fruchtstiel;   Zahnwurzel;  stummelhaft	  kurz	kurz-2
2997	1482	SHOULDER	váll	  Schutz;  Mieder;   Leibchen;  Achsel; Schulter;  Schulterstück;  Schulterstück eines Kleides	Schulter	Schulter-2
2998	715	SHOUT	abajgat	beunruhigen;  belästigen;   hetzen;  jagen;   schreien;   prügeln	  schreien	schreien-1
3000	715	SHOUT	bőg	 schreien; brüllen;  lärmen 〈Person〉;   muhen;   röhren;   brausen;  heulen 〈Gegenstand;  Naturerscheinung〉;   brüllend weinen;   Baßgeige	 schreien	schreien-3
3026	1901	SHOVEL	lapát	Schaufel;   Riemenblatt;  Ruderschaufel;   Schaufel 〈vom Wasserrad usw〉	Schaufel	Schaufel-1
3027	1901	SHOVEL	lapocka	  Schaufel; Schulterblatt;   〈Benennung versch Pflugteile〉	  Schaufel	Schaufel-2
3028	1039	SHOW	bök	strechen;  stoßen;   verletzen;   zeigen	  zeigen	zeigen-1
3030	1046	SHUT	csuk	einsperren;    schließen	   schließen	schlieen-1
3031	1847	SICK	beteg	Kranke; Kranke;   krank;   krank;   erkranken;   erkranken;   krank sein;   krank sein;   Erkrankung;   Erkrankung	  krank	krank-1
3032	1847	SICK	beteg	Kranke; Kranke;   krank;   krank;   erkranken;   erkranken;   krank sein;   krank sein;   Erkrankung;   Erkrankung	  krank	krank-2
3041	682	SIDE	fél²	Mitmensch;  Teil;   Mitte;  Nächste;   Hälfte;   Seite;   Partei;  Partner;  Gegner;   Ehefrau;   Gegend;  Landes- od Ortsteil;   einer 〈von beiden〉;   halb;   paarig;   Gattin;  Gefährte;   Halbbauer	  Seite	Seite-1
3042	682	SIDE	oldal	  Seite;   Nähe;  Abhang;   seitlich; Seite eines Terraingebildes;   Körperseite;  Fläche von etw;  Wand eines Baues;  Grenzfläche;   seitlicher Teil eines Raumes;  Seitenrichtung;   eine Hälfte;   eine Seite eines blattförmigen Gegenstandes;  Buchseite;   bestimmte Eigenschaft;   Rippenfleisch;   von der Seite beikommen	  Seite	Seite-2
3046	1720	SIGN	csóva	  Zeichen; Strohbund 〈als Hegewisch;  als Vogelscheuche usw〉;   Strohbündel zum Feuermachen;   Kometenschweif;   Ofenwisch	  Zeichen	Zeichen-2
3047	1720	SIGN	jel	  Bewerber; Zeichen;   Schriftzeichen;   Symbol;  Abzeichen;   Kennzeichen;   Äußerung;   Sternbild;  Karte;   Billett;  Symptom;   etw bezeichnende;  markierende Sache;  Signatur;   Vorzeichen;   Denkmal;   Zeichen 〈Art Wunder〉;   Suffix in der ungarischen Grammatik 〈mitAusnahme der Ablei-tungs- und Kasussuffixe〉;   Attribut	Zeichen	Zeichen-3
3053	3458	SILENCE	béke	Ruhe; Ruhe;   Friede;   Friede;  Friedenschluß;  Friedenschluß;   Bund;   Bund;   sich versöhnen;   sich versöhnen;   sich demütigen ;   sich demütigen 	Ruhe	Ruhe-1
3054	3458	SILENCE	béke	Ruhe; Ruhe;   Friede;   Friede;  Friedenschluß;  Friedenschluß;   Bund;   Bund;   sich versöhnen;   sich versöhnen;   sich demütigen ;   sich demütigen 	Ruhe	Ruhe-2
3062	759	SILVER	ezüst	Silber;   Silbermünze;   Silberzeug	Silber	Silber-1
3063	2971	SIN	bűn	Sünde;   Gesetzesbruch;   Fehler;  Mangel;   sünden;   sünden;   versündigen	Sünde	Sunde-1
3064	2971	SIN	gonosz	 schlimm;   krank;   Skandal;  Sünde;   böser Geist;  Teufel;  böser Mensch;   Übel; sittlich schlecht;   unheilvoll;  Schaden;   Schandtat;   sittlich schlechter;   Anstoß erregen;   Anstoß nehmen an etw;   moralisch verderben 〈intr〉	 Sünde	Sunde-2
3069	1261	SING	ária	Musikstück;   Arie;   Melodie;   singen;   rumoren 	  singen	singen-1
3070	1261	SING	döng	  singen; dröhnen;   summen;   sich um jmdn zu tun machen	  singen	singen-2
3076	1088	SINK (DESCEND)	bicsaklik	  hinken; mit jmdm geschlechtlich verkehren;   sich verrenken;   sinken;  sich 〈den Fuß〉 verstauchen;   stolpern	  sinken	sinken-1
3077	1088	SINK (DESCEND)	dől	  taumeln;   strömen;  sinken; sich erstrecken;  liegen;   in schiefe Lage kommen;  einstürzen;   sich entscheiden 〈Sache;  Frage〉;   sich hinlegen;   jmdm aufsitzen;   Ruine	 sinken	sinken-2
3083	1263	SISTER	húg	 Nonne; 〈als liebkosende Anrede an eine  Frau〉;   Schwester;   Nichte;   Klosterfrau;   jüngere Schwester	  Schwester	Schwester-1
3084	1263	SISTER	nővér	  Nonne;  Schwester;   Krankenschwester	 Schwester	Schwester-2
3085	1416	SIT	ül¹	 Herrschaft;  Beratung;   in Zorn geraten;   wohnen;   sich befinden;   verweilen;   pflanzen;  bedecken;  Antwort〉;   Wohnsitz;   anreizen;  sich empören;   stiften;   sich setzen;   Stuhl; sitzen;  besetzt halten;   Besitzung;  Amt antreten;  sich ruhig verhalten;   auf den Eiern sitzen;  liegen 〈Ortschaft〉;   lasten;   im Kerker sitzen;   sorgsam bewahren;  auf einem Buch;  auf seinem Geld usw sitzen;   einsteigen 〈in ein Fahrzeug〉;   beschwindelt werden;   Sitzung abhalten;   treffen 〈Anspielung;   Sitzen;   Sitzen;   Besetzung 〈durch Truppen〉;   Sitzung;   jmdm einen Sitz anbieten;   eine Henne setzen;   sich plötzlich aufrichten;   hereinlegen 〈abstr〉	sitzen	sitzen-1
3086	1416	SIT	ül¹	 Herrschaft;  Beratung;   in Zorn geraten;   wohnen;   sich befinden;   verweilen;   pflanzen;  bedecken;  Antwort〉;   Wohnsitz;   anreizen;  sich empören;   stiften;   sich setzen;   Stuhl; sitzen;  besetzt halten;   Besitzung;  Amt antreten;  sich ruhig verhalten;   auf den Eiern sitzen;  liegen 〈Ortschaft〉;   lasten;   im Kerker sitzen;   sorgsam bewahren;  auf einem Buch;  auf seinem Geld usw sitzen;   einsteigen 〈in ein Fahrzeug〉;   beschwindelt werden;   Sitzung abhalten;   treffen 〈Anspielung;   Sitzen;   Sitzen;   Besetzung 〈durch Truppen〉;   Sitzung;   jmdm einen Sitz anbieten;   eine Henne setzen;   sich plötzlich aufrichten;   hereinlegen 〈abstr〉	  Sitzen	Sitzen-1
